geneID,description_rna,description_prot,class,condition,enriched_NS_RNA,enriched_HS_RNA,depleted_NS_RNA,depleted_HS_RNA,rna_log2FC_NS,rna_log2FC_HS,strongest_rna_log2fc,log2FC_AP_NS,log2FC_AP_HS,log2FC_PDL_NS,log2FC_PDL_HS,protein_enriched,conflict_resolved
AT1G08370,"Encodes DCP1 involved in mRNA decapping.  DCP1 forms a mRNA decapping complex with DCP2 (At5g13570) and VCS (VARICOSE) (At3g13300). However, unlike DCP2, DCP1 itself does not have mRNA decapping activity in vitro.  DCP1, DCP2 and VCS colocalize in cytoplasmic loci, which are putative Arabidopsis mRNA processing bodies.  Null mutants of DCP1, DCP2, and VCS accumulate capped mRNAs with a reduced degradation rate. These mutants also share a similar lethal phenotype at the seedling cotyledon stage, with disorganized veins, swollen root hairs, and altered epidermal cell morphology. The protein was shown by immunoprecipitation not to interact with DCP2.","DCP1:p, mRNA-decapping enzyme-like protein",1,both,True,True,False,False,3.9905635904712637,5.283337073818592,5.283337073818592,6.573647187,7.627736524,2.883485991,3.979822118,True,False
AT5G23010,"Encodes a methylthioalkylmalate synthase, catalyzes the condensation reactions of the first two rounds of methionine chain elongation in the biosynthesis of methionine-derived glucosinolates. The mRNA is cell-to-cell mobile.","MAM1:p, methylthioalkylmalate synthase 1",1,both,True,True,False,False,3.008817346080978,2.744928642407292,3.008817346080978,0.387023123,0.273018494,-4.209453366,-4.807354922,True,False
AT5G14200,"The AtIMD1 is one out of 3 genes encoding the enzyme 3-isopropylmalate dehydrogenase involved in leucine biosynthesis in Arabidopsis. Its subcellular location has been targeted to plastids. Encodes methylthioalkylmalate dehydrogenase. Involved in glucosinolate biosynthesis, in methionine chain elongation. The mRNA is cell-to-cell mobile.","IMD1:p, 3-isopropylmalate dehydrogenase",1,both,True,True,False,False,2.8274586333511476,1.3716642916762973,2.8274586333511476,0.0,0.341036918,0.0,2.180572246,True,False
AT3G58990,"Small subunit, which together with IPMI SSU1, IPMISSU2 and IPMI LSU1, is a member of heterodimeric isopropylmalate isomerase (IPMI). Together with IPMI SSU3 participates in the Met chain elongation pathway.","IPMI1:p, 3-isopropylmalate dehydratase small subunit 2",1,NS,True,False,False,False,2.817674656978357,0.718076661497262,2.817674656978357,0.584962501,0.415037499,0.0,0.0,True,False
AT1G12200,Putative flavin monooxygenase.,"AT1G12200:p, Flavin-containing monooxygenase",1,both,True,True,False,False,2.793399688126006,1.9095848934389157,2.793399688126006,0.0,0.0,0.0,1.0,True,False
AT1G09590,Translation protein SH3-like family protein;(source:Araport11),"AT1G09690:p, 60S ribosomal protein L21-1",1,HS,False,True,False,False,-0.09965009947985892,2.7562428902255753,2.7562428902255753,0.0,0.0,-0.807354922,-0.906890596,True,False
AT1G68660,ClpS1 is a member of the caseionolytic proteinase S family of N-recognins. It is involved in proteolysis in the chloroplast stroma. An arginine residue (Arg50) controls low-affinity substrate binding.,"AT1G68660:p,",1,HS,False,True,False,False,-0.9030598860054067,2.6197698596464067,2.6197698596464067,0.0,0.0,-2.459431619,-2.169925001,True,False
AT3G11500,Small nuclear ribonucleoprotein family protein;(source:Araport11),"AT3G11500:p, Putative small nuclear ribonucleoprotein polypeptide ...",1,HS,False,True,False,False,-0.22126939502589404,2.6152977550310648,2.6152977550310648,-1.0,0.152003093,-0.584962501,0.415037499,True,False
AT2G47380,Cytochrome c oxidase subunit Vc family protein;(source:Araport11),"AT2G47380:p, Probable cytochrome c oxidase subunit 5C-1",1,HS,False,True,False,False,0.7223195616312006,2.574566947446946,2.574566947446946,0.0,0.0,-0.584962501,-0.584962501,True,False
AT1G74090,"encodes a desulfoglucosinolate sulfotransferase, involved in the final step of glucosinolate core structure biosynthesis. Has a broad-substrate specificity with preference with methionine-derived desulfoglucosinolates.","SOT18:p, Sulfotransferase",1,both,True,True,False,False,2.528672199139109,1.6450852510700025,2.528672199139109,0.584962501,0.222392421,-0.736965594,0.222392421,True,False
AT5G04230,"Member of Phenylalanine ammonialyase (PAL) gene family. Differs significantly from PAL1 and PAL2 and other sequenced plant PAL genes.  Arabidopsis has four PALs: AT2G37040 (PAL1), AT3G53260 (PAL2), AT5G04230 (PAL3) and AT3G10340 (PAL4).","PAL3:p, Phenylalanine ammonia-lyase",1,both,True,True,False,False,2.4767993152040075,1.995717928767951,2.4767993152040075,1.0,0.584962501,0.584962501,0.415037499,True,False
AT4G12390,pectin methylesterase inhibitor 1;(source:Araport11),"PME1:p, Pectin methylesterase inhibitor 1",1,NS,True,False,False,False,2.4622948321590394,0.5257481771422344,2.4622948321590394,0.765534746,0.203533394,0.0,0.0,True,False
AT3G52040,"2,3-bisphosphoglycerate-dependent phosphoglycerate mutase;(source:Araport11)","AT3G52040:p,",1,NS,True,False,False,False,2.450940420361514,0.346369018616175,2.450940420361514,0.0,0.415037499,0.0,0.0,True,False
AT1G11530,"Encodes a monocysteinic thioredoxin, thioredoxin in which the second cysteine of the redox site is replaced by a serine, with low disulfide reductase but efficient disulfide isomerase activity. The mRNA is cell-to-cell mobile.","CXXS1:p, Thioredoxin-like protein CXXS1",1,HS,False,True,False,False,-0.6984557866315627,2.4424763186764276,2.4424763186764276,1.0,-0.584962501,0.0,0.0,True,False
AT1G27130,"Encodes glutathione transferase belonging to the tau class of GSTs. Naming convention according to Wagner et al. (2002). GSTU13 acts in the pathogen triggered pathway for indole glucosinolate metabolisms that involves also PENETRATION2 myrosinase. It is likely the enzyme that conjugates GSH with unstable indol-3-ylmethyl-ITCs formed upon PEN2-mediated IG hydrolysis, particularly in the branch of this pathway in which 4-substituted IGs are processed.","GSTU13:p, Glutathione S-transferase U13",1,HS,False,True,False,False,0.4048295459870157,2.4372003284796673,2.4372003284796673,-0.584962501,-0.169925001,0.0,0.0,True,False
AT4G04614,hypothetical protein;(source:Araport11),"AT4G04614:p, At4g04614",1,HS,False,True,False,False,0.5713535324090537,2.430014909614319,2.430014909614319,0.0,0.0,-1.0,-0.584962501,True,False
AT4G05000,Vacuolar protein sorting-associated protein VPS28 family protein;(source:Araport11),"VPS28-2:p, Vacuolar protein sorting-associated protein 28 homolog ...",1,HS,False,True,False,False,0.4188430488620486,2.4281212583878347,2.4281212583878347,0.0,0.0,1.95419631,2.313157885,True,False
AT5G09830,Encodes a cytosolic BolA protein. Plays a repressive role in the tolerance against excess iron and methyl viologen-induced oxidative stress.,"AT5G09830:p, Protein BOLA2",1,HS,False,True,False,False,-0.47903588563109745,2.422387086280938,2.422387086280938,0.584962501,0.0,0.0,0.0,True,False
AT3G11930,Adenine nucleotide alpha hydrolases-like superfamily protein;(source:Araport11),"AT3G11930:p, AT3G11930 protein",1,both,True,True,False,False,2.211639377290528,2.4154784747382694,2.4154784747382694,0.502500341,0.736965594,1.321928095,-0.169925001,True,False
AT3G56240,"CCH protein belongs to a family of eukaryotic proteins that participate in  intracellular copper homeostasis by delivering this metal to the secretory pathway; mainly located along the vascular bundles of senescing leaves and petioles as well as in stem sieve elements; hypothesized  to have a role in copper mobilization from decaying organs towards reproductive structures, as a result of metalloprotein breakdown. The plant-specific C-terminal domain of the CCH protein forms amyloid-like fibrils in vitro.","CCH:p, Copper transport protein CCH",1,both,True,True,False,False,1.7971337647173784,2.378340668505047,2.378340668505047,0.275634443,-0.339850003,-0.584962501,-1.0,True,False
AT5G24314,plastid transcriptionally active7;(source:Araport11),"PTAC7:p, plastid transcriptionally active7",1,HS,False,True,False,False,-0.486903258458517,2.368679131036096,2.368679131036096,0.0,0.0,0.0,-0.584962501,True,False
AT1G07660,Histone superfamily protein;(source:Araport11),"AT1G07820:p, Histone H4",1,NS,True,False,False,False,2.3600117776062244,0.10222436883729143,2.3600117776062244,0.0,0.0,0.0,-0.584962501,True,False
AT3G60370,"Encodes an immunophilin, FKBP20-2, that belongs to the FK-506 binding protein (FKBP) subfamily functioning as peptidyl-prolyl isomerases (PPIases) in protein folding. FKBP20-2 has a unique pair of cysteines at the C terminus and was found to be reduced by thioredoxin (Trx) (itself reduced by NADPH by means of NADP-Trx reductase). The FKBP20-2 protein, which contains only two of the five amino acids required for catalysis, showed a low level of PPIase activity that was unaffected on reduction by Trx.  Genetic disruption of the FKBP20-2 gene provide evidence that FKBP20-2 participates specifically in the accumulation of the PSII supercomplex in the chloroplast thylakoid lumen by means of a mechanism that has yet to be determined.","AT3G60370:p, Peptidylprolyl isomerase",1,HS,False,True,False,False,-0.2336492710229288,2.35236503477627,2.35236503477627,0.736965594,0.736965594,0.0,0.0,True,False
AT4G14340,Phosphorylates serine or threonine residues that are near and C-terminal to acidic side chains on a variety of target proteins. Member of CKL gene family (CKL-C group).,"CKI1:p, Casein kinase 1-like protein 11",1,HS,False,True,False,False,0.9326384607214805,2.3208416250620103,2.3208416250620103,0.584962501,0.0,0.0,0.0,True,False
AT1G48600,Encodes a phosphoethanolamine N-methyltransferase that catalyses the last two methylation steps of the three sequential methylations of phosphoethanolamine (PEA) that are required for the synthesis of phosphocholine (PCho) in plants.,"PMEAMT:p, PMEAMT",1,both,True,True,False,False,2.1617231033733035,2.2615016713824088,2.2615016713824088,-0.053439259,0.017702002,0.612976877,-0.807354922,True,False
AT1G03400,"A single copy gene that encodes a protein with sequence similarity to tomato E8 (ACC oxidase, the last step in ethylene biosynthesis) involved in ethylene synthesis and fruit ripening in tomato. This gene is not induced by ethylene in siliques. The transcript is found in siliques, etiolated seedlings, leaves, stems and flowers.","AT1G03400:p, 2-oxoglutarate (2OG) and Fe(II)-dependent oxygenase ...",1,NS,True,False,False,False,2.2385906152625177,0.6089516716013387,2.2385906152625177,1.0,0.0,0.0,1.584962501,True,False
AT3G50440,"Encodes a protein shown to have methyl jasmonate esterase activity in vitro. This protein does not act on methyl IAA, MeSA, MeGA4, or MEGA9 in vitro.","MES10:p, Methylesterase 10",1,NS,True,False,False,False,2.2367393478823736,0.9987762192029955,2.2367393478823736,0.0,-0.169925001,0.584962501,0.0,True,False
AT3G62820,Plant invertase/pectin methylesterase inhibitor superfamily protein;(source:Araport11),"AT3G62820:p, Plant invertase/pectin methylesterase inhibitor superfamily protein",1,HS,False,True,False,False,0.19530008687792344,2.2355891433884367,2.2355891433884367,1.0,0.736965594,0.0,0.0,True,False
AT5G06770,KHZ2  is a CCCH zinc-finger and KH domain protein belonging to the VII subfamily. It is expressed throughout the plant. Highly similar to KHZ1.Double mutants with khz1 are  late flowering. Overexpression leads to increased rates of leaf senescence.,"AT5G06770:p, Zinc finger CCCH domain-containing protein 52",1,HS,False,True,False,False,0.21301106757605584,2.217596773034403,2.217596773034403,0.0,-0.459431619,0.0,0.0,True,False
AT3G02190,Ribosomal protein L39 family protein;(source:Araport11),"AT3G02190:p, 60S ribosomal protein L39-2",1,NS,True,False,False,False,2.2147954062020654,0.4716959591499276,2.2147954062020654,0.0,0.0,0.0,0.415037499,True,False
AT1G78370,Encodes glutathione transferase belonging to the tau class of GSTs. Naming convention according to Wagner et al. (2002).,"GSTU20:p, Glutathione S-transferase U20",1,both,True,True,False,False,2.197013912263539,2.11966925271602,2.197013912263539,0.321928095,1.115477217,1.321928095,0.0,True,False
AT5G20500,Glutaredoxin family protein;(source:Araport11),"AT5G20500:p, Glutaredoxin-C4",1,HS,False,True,False,False,0.50697587317913,2.1465245101510297,2.1465245101510297,-0.106915204,0.245112498,0.0,0.0,True,False
AT3G09980,"Encodes ACIP1, a microtubules-associated protein required for bacterial immunity. The mRNA is cell-to-cell mobile.","AT3G09980:p, Ankyrin repeat 30A-like protein (DUF662)",1,NS,True,False,False,False,2.1294969925204614,0.4982144322941174,2.1294969925204614,0.0,-0.392317423,-2.321928095,-1.847996907,True,False
AT5G51120,"Encodes a homolog of the protein PABN1, a polyadenylation factor subunit.","PABN1:p, Polyadenylate-binding protein 1",1,HS,False,True,False,False,-0.37930959605633713,2.122952227729987,2.122952227729987,0.0,-0.906890596,0.0,0.0,True,False
AT1G52670,Single hybrid motif superfamily protein;(source:Araport11),"AT1G52670:p, Is a member of the PF",1,HS,False,True,False,False,0.003325665432335017,2.11548909186102,2.11548909186102,0.0,0.0,0.074000581,0.489038081,True,False
AT3G32930,"Protein of unknown function. Locus is correlated with bacterial hypersensitive response, expression is reduced after injection with avrRpm1.","AT3G32930:p, 6,7-dimethyl-8-ribityllumazine synthase",1,HS,False,True,False,False,0.8207292965065067,2.110819860207606,2.110819860207606,0.0,0.0,-1.0,-1.0,True,False
AT1G24100,"Encodes a UDP-glucose:thiohydroximate S-glucosyltransferase, involved in glucosinolate biosynthesis","UGT74B1:p, Glycosyltransferase",1,both,True,True,False,False,1.8487923969795366,2.098612169523427,2.098612169523427,0.584962501,-0.321928095,0.584962501,0.0,True,False
AT2G20690,A synthetic gene encoding the catalytic domain of the Arabidopsis thaliana gene At2g20690 was recombinant expressed in E. coli demonstrating the molecular function of riboflavin synthase. The mRNA is cell-to-cell mobile.,"AT2G20690:p, At2g20690/F5H144",1,HS,False,True,False,False,0.5292952476710682,2.09675925416923,2.09675925416923,-1.263034406,-0.906890596,0.0,0.0,True,False
AT1G78995,hypothetical protein;(source:Araport11),"AT1G78995:p, At1g78995",1,NS,True,False,False,False,2.096392755836961,0.0,2.096392755836961,0.0,-0.584962501,0.0,0.0,True,False
AT5G52100,"Is essential for chloroplast NAD(P)H dehydrogenase activity, which is involved in electron transfer between PSII and PSI. Likely functions in biogenesis or stabilization of the NAD(P)H dehydrogenase complex. The mRNA is cell-to-cell mobile.","crr1:p, CRR1",1,HS,False,True,False,False,-0.6313507403106023,2.085001541909097,2.085001541909097,0.0,0.0,0.0,0.0,True,False
AT2G03440,Induced at the transcriptional level by Pseudomonas syringae pv. tomato infection.,"NRP1:p, Nodulin-related protein 1",1,HS,False,True,False,False,0.4773656485273075,2.0826773237956084,2.0826773237956084,0.222392421,0.584962501,-1.556393349,-0.667424661,True,False
AT5G18100,A putative peroxisomal CuZnSOD inducible by a high-light pulse.,"CSD3:p, Superoxide dismutase  3",1,HS,False,True,True,False,-1.5058242512946427,2.079375498916873,2.079375498916873,0.0,-0.584962501,0.0,0.0,True,True
AT5G48870,"SAD1 encodes a polypeptide similar to multifunctional Sm-like snRNP proteins that are required for mRNA splicing, export, and degradation. Mutation in this gene increases plant sensitivity to drought stress and ABA in seed germination, root growth, and the expression of some stress-responsive genes.","SAD1:p, SAD1",1,NS,True,False,False,False,2.0772698355455823,0.2487033519410835,2.0772698355455823,0.0,0.0,1.321928095,1.584962501,True,False
AT4G10970,"UAP56-interacting factor1, binds single stranded RNA and, along with UIEF2,,appears to play a role in nuclear export of RNA.","AT4G10970:p, unknown protein; BEST Arabidopsis thaliana protein ...",1,HS,False,True,False,False,-0.010569828742131884,2.076622040305923,2.076622040305923,-0.584962501,-0.362570079,0.0,0.0,True,False
AT1G21440,Phosphoenolpyruvate carboxylase family protein;(source:Araport11),"AT1G21440:p, At1g21440",1,both,True,True,False,False,1.411433484473028,2.05185860295671,2.05185860295671,-0.263034406,0.415037499,-3.321928095,-3.087462841,True,False
AT5G65270,RAB GTPase homolog A4A;(source:Araport11),"RABA4a:p, RABA4a",1,HS,False,True,False,False,0.04275147655562598,2.051110126456776,2.051110126456776,0.0,0.0,0.0,-0.584962501,True,False
AT2G04690,Pyridoxamine 5-phosphate oxidase family protein;(source:Araport11),"AT2G04690:p, Pyridoxamine 5 -phosphate oxidase family protein ...",1,HS,False,True,False,False,-0.19005699609642304,2.031695782558951,2.031695782558951,0.0,1.0,0.0,0.0,True,False
AT4G26720,"Encodes catalytic subunit of protein phosphatase X. Expressed at very low levels in A. thaliana flowers, leaves, stems and roots.","PPX1:p, Serine/threonine-protein phosphatase",1,HS,False,True,False,False,0.7584705285937201,2.027861775354509,2.027861775354509,0.0,-0.169925001,0.0,0.0,True,False
AT5G01650,Chemokine-like MDL protein; modulate flowering time and innate immunity in plants.,"AT5G01650:p, Tautomerase/MIF superfamily protein",1,HS,False,True,False,False,-0.023522713399057676,2.015407586805678,2.015407586805678,-0.584962501,0.415037499,0.0,-0.584962501,True,False
AT5G67490,"SDHAF4 acts on FAD-SDH1 and promotes its assembly with SDH2, thereby stabilizing SDH2 and enabling its full assembly with SDH3/SDH4 to form the SDH complex.","AT5G67490:p, At5g67490",1,HS,False,True,False,False,0.06259842418130572,2.0138634706500627,2.0138634706500627,1.0,-0.263034406,0.0,0.0,True,False
AT1G32550,"Encodes FdC2, a ferredoxin protein capable of alternative electron partitioning.  FdC1 level increases in conditions of acceptor limitation at PSI.","AT1G32550:p, 2Fe-2S ferredoxin-like superfamily protein",1,both,True,True,False,False,2.01107370589488,1.4045358834305477,2.01107370589488,-0.321928095,0.152003093,-0.415037499,-0.584962501,True,False
AT4G29830,"VIP3 protein is composed of repeats of WD motif which is involved in protein complex formation. The gene is involved in flower timing and flower development. This gene is predicted to encode a protein with a DWD motif. It can bind to DDB1a in Y2H assays, and DDB1b in co-IP assays, and may be involved in the formation of a CUL4-based E3 ubiquitin ligase.  Loss of gene function leads to a redistribution of H3K4me3 and K3K36me2 modifications within genes but not a change in the overall abundance of these modifications within chromatin. Also known as SKI8, a component of the SKI complex involved in exosome mediated RNA degredation. Member of PAF-C complex.","VIP3:p, WD repeat-containing protein VIP3",1,HS,False,True,False,False,0.22826453299089608,1.9969203485080762,1.9969203485080762,0.0,0.0,-2.169925001,-1.432959407,True,False
AT2G31040,Encodes an integral thylakoid protein that facilitates assembly of the membranous part of the chloroplast ATPase.,"AT2G31040:p, Protein CONSERVED ONLY IN THE GREEN LINEAGE 160, ...",1,HS,False,True,False,False,-0.7885085928915603,1.9969087822378586,1.9969087822378586,0.0,0.0,0.0,-0.584962501,True,False
AT2G21280,"A nuclear-encoded, plastid-targeted protein (AtSulA) whose overexpression causes severe yet stochastic plastid (shown in chloroplasts and leucoplasts) division defects. The protein does not appear to interact with either AtFtsZ proteins when studied in a yeast two-hybrid system.","SULA:p, NAD(P)-binding Rossmann-fold superfamily protein",1,HS,False,True,False,False,-0.8514594062559844,1.9783798373870483,1.9783798373870483,0.584962501,-0.054447784,1.584962501,0.0,True,False
AT1G78020,FCS like zinc finger 6 is induced during energy starvation through SnRK1 signaling. Mutants accumulate more SnRK1alpha1 which results in the inhibition of seedling growth under favorable growth conditions. Increased SnRK1 activity in the mutant also results in the downregulation of TOR signaling (DOI:10.1111/tpj.13854).,"AT1G78020:p, FCS-Like Zinc finger 6",1,HS,False,True,False,False,0.49344483386027693,1.975630374015932,1.975630374015932,0.584962501,0.415037499,0.0,0.736965594,True,False
AT2G35605,SWIB/MDM2 domain superfamily protein;(source:Araport11),"AT2G35605:p, Expressed protein",1,both,True,True,False,False,1.9682542789434616,1.3688440432044913,1.9682542789434616,0.0,-0.584962501,0.0,0.0,True,False
AT2G28430,"zinc finger, C3HC4 type family protein;(source:Araport11)","AT2G28430:p, At2g28430/T1B3",1,NS,True,False,False,False,1.9611324692004841,-0.27216338025548653,1.9611324692004841,-0.415037499,-0.584962501,0.415037499,0.0,True,False
AT2G37680,glucose-induced degradation-like protein;(source:Araport11),"AT2G37680:p, CONTAINS InterPro DOMAIN/s: Vacuolar import/degradation ...",1,both,True,True,False,False,1.4032096315585036,1.956863852398391,1.956863852398391,1.0,0.152003093,0.0,0.0,True,False
AT3G22231,Encodes a member of a novel 6 member Arabidopsis gene family.  Expression of PCC1 is regulated by the circadian clock and is upregulated in response to both virulent and avirulent strains of Pseudomonas syringae pv. tomato.,"PCC1:p, Cysteine-rich and transmembrane domain-containing protein ...",1,NS,True,False,False,False,1.954032113039976,0.6816161270165699,1.954032113039976,0.584962501,0.0,0.0,0.0,True,False
AT5G22880,"Encodes a histone 2B (H2B) protein. This protein can be ubiquitinated in planta, and this modification depends on the HUB1 and HUB2 E3 ubiquitin ligases.","HTB2:p, Histone H2B",1,both,True,True,False,False,1.9513104295139472,1.052642756009582,1.9513104295139472,0.0,0.093109404,0.0,-0.263034406,True,False
AT5G42990,ubiquitin-conjugating enzyme 18;(source:Araport11),"UBC18:p, Probable ubiquitin-conjugating enzyme E2 18",1,both,True,True,False,False,1.9412199562748793,1.450599356997242,1.9412199562748793,-0.584962501,0.736965594,0.0,0.0,True,False
AT3G06980,DEA(D/H)-box RNA helicase family protein;(source:Araport11),"AT3G06980:p, DEAD-box ATP-dependent RNA helicase 50",1,HS,False,True,False,False,0.4438642098138533,1.9255105562665598,1.9255105562665598,0.115477217,0.502500341,-3.459431619,-3.169925001,True,False
AT2G27960,"catalytic subunit of cyclin dependent kinase 1. physically interact with cyclin-dependent kinases (CDKs) and play an essential, but yet not entirely resolved, role in the regulation of the cell cycle","CKS1:p,",1,HS,False,True,False,False,-0.30009323580541497,1.9237806188353712,1.9237806188353712,0.0,0.0,-0.736965594,0.678071905,True,False
AT1G54290,Translation initiation factor SUI1 family protein;(source:Araport11),"AT1G54290:p,",1,both,True,True,False,False,1.9204985409031528,1.0829951426500444,1.9204985409031528,0.0,0.093109404,0.0,0.0,True,False
AT3G52720,"Encodes an alpha carbonic anhydrase (CAH1) located in the chloroplast stroma. Most chloroplast proteins are encoded by the nuclear genome and imported with the help of sorting signals that are intrinsic parts of the polypeptides. CAH1 takes an alternative route through the secretory pathway, and becomes N-glycosylated before entering the chloroplast.  Glycosylation and intra-molecular disulfide bridge fromation are necessary for the correct folding, ER export, trafficking and activity of the protein.","ACA1:p, Alpha carbonic anhydrase 1, chloroplastic",1,both,True,True,False,False,1.9131835927772187,1.5931864267992395,1.9131835927772187,0.415037499,1.415037499,0.0,0.0,True,False
AT5G64160,plant/protein;(source:Araport11),"AT5G64160:p, AT5g64160/MHJ24_14",1,HS,False,True,False,False,0.409593277771904,1.913100995792602,1.913100995792602,0.0,0.0,0.0,-0.584962501,True,False
AT4G27690,vacuolar protein sorting 26B;(source:Araport11),"VPS26B:p, VPS26B",1,HS,False,True,False,False,-0.7125918735460801,1.902933016006693,1.902933016006693,0.584962501,0.0,0.0,0.0,True,False
AT5G08080,member of SYP13 Gene Family,"SYP132:p, Syntaxin of plants 132",1,NS,True,False,False,False,1.89860050294091,0.34332217988604896,1.89860050294091,0.0,-0.584962501,-2.415037499,-2.807354922,True,False
AT5G48020,2-oxoglutarate (2OG) and Fe(II)-dependent oxygenase superfamily protein;(source:Araport11),"AT5G48020:p, 2-oxoglutarate (2OG) and Fe(II)-dependent oxygenase ...",1,HS,False,True,False,False,0.17824635549248394,1.8906631616248697,1.8906631616248697,0.08246216,-0.028569152,0.0,0.0,True,False
AT3G54560,"Encodes HTA11, a histone H2A protein. Loss of all H2A.Z (triple mutant with HTA8 and HTA9) results in a reduction in DNA methylation of transposons but not that of genes.  Loss of H2A.Z causes misregulation of many genes involved in the response to developmental and environmental cues, and that these genes tend to have high levels of gene-body H2A.Z.","HTA11:p, Histone H2A",1,NS,True,False,False,False,1.8899426828502857,0.5174591535905638,1.8899426828502857,0.584962501,0.736965594,0.321928095,-0.584962501,True,False
AT4G10300,"RmlC-like cupins superfamily protein. Overexpression leads to trehalose resistance, drought and stress tolerance.","AT4G10300:p, At4g10300",1,HS,False,True,False,False,-0.25932355723715583,1.8864842051920745,1.8864842051920745,0.0,0.152003093,0.0,0.0,True,False
AT5G42070,hypothetical protein;(source:Araport11),"AT5G42070:p, Uncharacterized protein At5g42070",1,HS,False,True,False,False,0.26310770577892356,1.8814862778795787,1.8814862778795787,-0.584962501,0.0,0.0,0.0,True,False
AT4G33670,"Encodes a L-galactose dehydrogenase, involved in ascorbate biosynthesis","AT4G33670:p, L-galactose dehydrogenase",1,HS,False,True,False,False,0.043193362546293954,1.881060440581624,1.881060440581624,0.0,0.0,0.0,0.0,True,False
