geneID,description_rna,description_prot,class,condition,enriched_NS_RNA,enriched_HS_RNA,depleted_NS_RNA,depleted_HS_RNA,rna_log2FC_NS,rna_log2FC_HS,strongest_rna_log2fc,log2FC_AP_NS,log2FC_AP_HS,log2FC_PDL_NS,log2FC_PDL_HS,protein_enriched,conflict_resolved
AT2G07712,pseudogene of Intron maturase;(source:Araport11),,0,depleted,False,False,True,True,-1.1410300169884082,-1.5601367804144979,1.5601367804144979,,,,,,False
AT1G07040,plant/protein;(source:Araport11),,0,depleted,False,False,True,False,-1.5549349887421393,-0.4073931611783598,1.5549349887421393,,,,,,False
AT5G63480,mediator of RNA polymerase II transcription subunit;(source:Araport11),,0,depleted,False,False,False,True,-0.41130810190195866,-1.5537898071271792,1.5537898071271792,,,,,,False
AT4G24750,Rhodanese/Cell cycle control phosphatase superfamily protein;(source:Araport11),"AT4G24750:p, Rhodanese-like domain-containing protein 11, chloroplastic ...",0,depleted,False,False,False,True,-0.37663170781954153,-1.5482284375411441,1.5482284375411441,-1.0,0.093109404,0.0,-0.584962501,True,False
AT2G07698,"ATPase, F1 complex, alpha subunit protein;(source:Araport11)","AT2G07698:p, ATPase, F1 complex, alpha subunit protein",0,depleted,False,False,True,True,-1.2250434731108473,-1.547048214032855,1.547048214032855,-0.308122295,-0.216317907,0.033166864,-0.392317423,True,False
AT2G07683,"transposable_element_gene;(source:Araport11);copia-like retrotransposon family, has a 2.2e-110 P-value blast match to GB:AAA57005 Hopscotch polyprotein (Ty1_Copia-element) (Zea mays);(source:TAIR10)",,0,depleted,False,False,True,True,-1.5438838017768994,-1.137100568743863,1.5438838017768994,,,,,,False
AT5G63600,encodes a protein whose sequence is similar to flavonol synthase,,0,depleted,False,False,True,True,-1.5433373818943574,-1.184761616750393,1.5433373818943574,,,,,,False
AT1G65347,"transposable_element_gene;(source:Araport11);copia-like retrotransposon family, has a 7.5e-50 P-value blast match to GB:CAA72989 open reading frame 1 (Ty1_Copia-element) (Brassica oleracea);(source:TAIR10)",,0,depleted,False,False,False,True,-0.24864203483808697,-1.541028770193331,1.541028770193331,,,,,,False
AT2G33480,NAC domain containing protein 41;(source:Araport11),,0,depleted,False,False,False,True,0.11124456752887953,-1.541019648904966,1.541019648904966,,,,,,False
AT1G27730,"Related to Cys2/His2-type zinc-finger proteins found in higher plants. Compensated for a subset of calcineurin deficiency in yeast. Salt tolerance produced by ZAT10 appeared to be partially dependent on ENA1/PMR2, a P-type ATPase required for Li+ and Na+ efflux in yeast. The protein is localized to the nucleus, acts as a transcriptional repressor and is responsive to chitin oligomers. Also involved in response to photooxidative stress.",,0,depleted,False,False,True,False,-1.5392244320869128,-0.011299235863755488,1.5392244320869128,,,,,,False
AT3G58720,RING/U-box superfamily protein;(source:Araport11),,0,depleted,False,False,True,False,-1.5366234029714116,0.0,1.5366234029714116,,,,,,False
AT3G44260,"Encodes one of the homologs of the yeast CCR4-associated factor 1: AT3G44260 (CAF1a), AT5G22250 (CAF1b). Has mRNA deadenylation activity.  Also plays a role in plant defense responses.",,0,depleted,False,False,True,False,-1.5362700750596492,-0.7975901001626032,1.5362700750596492,,,,,,False
AT1G32310,"Encodes a plant-specific negative regulator of the APC/C complex. It is expressed during embryogenesis and early plant development and plays a key role in organ size control. Mutants are defective in mitosis I of pollen development, resulting in pollen without sperm nuclei.",,0,depleted,False,False,True,False,-1.5358324993011874,-0.5604824453745226,1.5358324993011874,,,,,,False
AT2G07733,pseudogene of NADH dehydrogenase 2B;(source:Araport11),,0,depleted,False,False,True,True,-1.0985338601264496,-1.5352915531326652,1.5352915531326652,,,,,,False
AT2G07695,"Cytochrome C oxidase subunit II-like, transmembrane domain-containing protein;(source:Araport11)",,0,depleted,False,False,True,True,-1.1179494856710488,-1.5348183579611074,1.5348183579611074,,,,,,False
AT2G07725,Ribosomal L5P family protein;(source:Araport11),,0,depleted,False,False,True,True,-1.121564259566275,-1.533521301826502,1.533521301826502,,,,,,False
AT2G07808,Pseudogene of ATMG01330,,0,depleted,False,False,True,True,-1.3254241777368425,-1.5296537179085028,1.5296537179085028,,,,,,False
AT5G43580,"Predicted to encode a PR (pathogenesis-related) peptide that belongs to the PR-6 proteinase inhibitor family. Functions in resistance to necrotrophic fungi and insect herbivory. Six putative PR-6-type protein encoding genes are found in Arabidopsis: At2g38900, At2g38870, At5g43570, At5g43580, At3g50020 and At3g46860.",,0,depleted,False,False,True,False,-1.5286032886982672,-0.4440422303930529,1.5286032886982672,,,,,,False
AT4G02980,Auxin binding protein involved in cell elongation and cell division. ABP1 is ubiquitinated in vitro and in planta by AtRma2. ABP1 was thought to be embryo lethal but further experimentation has demonstrated that lethality is due to a linked mutation in another gene.,,0,depleted,False,False,True,False,-1.5282379853066537,0.7609988288507904,1.5282379853066537,,,,,,False
AT1G05680,"Encodes a UDP-glucosyltransferase, UGT74E2,  that acts on IBA (indole-3-butyric acid) and affects auxin homeostasis. The transcript and protein levels of this enzyme are strongly induced by H2O2 and may allow integration of ROS (reactive oxygen species) and auxin signaling. This enzyme can also transfer glycosyl groups to several compounds related to the explosive TNT when this synthetic compound is taken up from the environment.","UGT74E2:p, Glycosyltransferase (Fragment)",0,depleted,False,True,True,False,-1.5251960348485152,1.279556001455159,1.5251960348485152,-0.321928095,0.415037499,0.584962501,0.0,True,True
AT5G67430,Acyl-CoA N-acyltransferases (NAT) superfamily protein;(source:Araport11),,0,depleted,False,False,True,False,-1.5210903003741434,-0.2868722241438319,1.5210903003741434,,,,,,False
AT2G07708,hypothetical protein;(source:Araport11),,0,depleted,False,False,True,True,-1.1485240789250504,-1.5196611834469926,1.5196611834469926,,,,,,False
AT3G50825,snoRNA;(source:Araport11),,0,depleted,False,False,False,True,0.0009959184846015177,-1.5191095560483268,1.5191095560483268,,,,,,False
AT1G77855,Phosphatidylinositol 4-phosphate 5-kinase (PIP5K) enzyme family member.,,0,depleted,True,False,False,True,1.0001042309514063,-1.5157318767952128,1.5157318767952128,,,,,,False
AT3G57090,Encodes a protein with similarity to yeast FIS proteins. These membrane anchored proteins bind DRP proteins and function during organelle division. FIS1B is expressed ubiquitously and appears to be involved in peroxisome division.,"BIGYIN:p, Mitochondrial fission 1 protein A",0,depleted,False,False,True,False,-1.5154012663269822,0.9325977192582746,1.5154012663269822,0.584962501,-0.584962501,0.0,0.0,True,False
AT5G63670,Transcription elongation factor SPT4  homolog 2. T-DNA mutant is more susceptible to the biotroph Hpa.,,0,depleted,False,False,True,False,-1.5148946321335242,0.24082514350841192,1.5148946321335242,,,,,,False
AT2G07671,ATP synthase subunit C family protein;(source:Araport11),,0,depleted,False,False,True,True,-1.0698016218860107,-1.5148396615546669,1.5148396615546669,,,,,,False
AT1G52905,hypothetical protein;(source:Araport11),,0,depleted,False,False,True,False,-1.5135715791751279,0.5734802038653718,1.5135715791751279,,,,,,False
AT1G14820,Sec14p-like phosphatidylinositol transfer family protein;(source:Araport11),,0,depleted,False,False,True,False,-1.5087058717468518,0.6167193029881857,1.5087058717468518,,,,,,False
AT3G28370,spindle assembly checkpoint component;(source:Araport11),,0,depleted,False,False,True,False,-1.5078846869250944,-0.3660922040910916,1.5078846869250944,,,,,,False
AT3G53490,valine-tRNA ligase;(source:Araport11),,0,depleted,False,False,True,False,-1.5062625673594288,0.5776453822125517,1.5062625673594288,,,,,,False
AT5G55370,MBOAT (membrane bound O-acyl transferase) family protein;(source:Araport11),,0,depleted,False,False,True,False,-1.5055800056062871,0.0,1.5055800056062871,,,,,,False
AT2G35859,Natural antisense transcript overlaps with AT2G35860;(source:Araport11),,0,depleted,False,False,True,False,-1.5046017161022007,-0.07789950692043539,1.5046017161022007,,,,,,False
AT3G21352,transmembrane protein;(source:Araport11),,0,depleted,False,False,True,False,-1.504212821155221,-0.689730036400659,1.504212821155221,,,,,,False
AT5G20790,transmembrane protein;(source:Araport11),,0,depleted,False,False,True,False,-1.503718640315761,0.6298984151075905,1.503718640315761,,,,,,False
AT2G07724,hypothetical protein;(source:Araport11),,0,depleted,False,False,True,True,-1.5021303012194898,-1.2583317012967032,1.5021303012194898,,,,,,False
AT1G07610,one of the five metallothioneins (MTs) genes identified in Arabidopsis. MTs are cysteine-rich proteins required for heavy metal tolerance. The mRNA is cell-to-cell mobile.,,0,depleted,False,False,True,False,-1.50102273029646,0.3474986164528237,1.50102273029646,,,,,,False
AT3G09925,Involved in shoot regeneration from root explants.,,0,depleted,False,False,True,False,-1.5001779397303225,0.0,1.5001779397303225,,,,,,False
AT2G07687,"Cytochrome c oxidase, subunit III;(source:Araport11)",,0,depleted,False,False,True,True,-1.104648621851198,-1.4998204148789782,1.4998204148789782,,,,,,False
AT3G29633,hypothetical protein;(source:Araport11),,0,depleted,False,False,True,False,-1.498372661596326,0.0,1.498372661596326,,,,,,False
AT5G66607,This gene encodes a small protein and has either evidence of transcription or purifying selection.,,0,depleted,False,False,True,True,-1.498372661596326,-1.179623467822944,1.498372661596326,,,,,,False
AT3G21720,Encodes a glyoxylate cycle enzyme isocitrate lyase (ICL) involved in salt tolerance.,,0,depleted,False,False,True,True,-1.4906229177677357,-1.1501831159646743,1.4906229177677357,,,,,,False
AT2G32460,Member of the R2R3 factor gene family.,,0,depleted,False,False,True,False,-1.4902525485605818,0.0,1.4902525485605818,,,,,,False
AT2G07768,Cytochrome C assembly protein;(source:Araport11),,0,depleted,False,False,True,True,-1.0043297202415835,-1.487435635663687,1.487435635663687,,,,,,False
AT5G60590,DHBP synthase RibB-like alpha/beta domain-containing protein;(source:Araport11),,0,depleted,False,False,True,False,-1.4860995844727511,-0.6750524341249088,1.4860995844727511,,,,,,False
AT4G15620,Uncharacterized protein family (UPF0497);(source:Araport11),,0,depleted,False,False,True,False,-1.4839264172536317,-0.42548733732517785,1.4839264172536317,,,,,,False
AT2G07774,hypothetical protein;(source:Araport11),,0,depleted,False,False,True,True,-1.4826324470314574,-1.4767509517765611,1.4826324470314574,,,,,,False
AT1G17410,Nucleoside diphosphate kinase family protein;(source:Araport11),,0,depleted,False,False,True,False,-1.4787300042268419,0.573887994841925,1.4787300042268419,,,,,,False
AT5G64310,Encodes arabinogalactan-protein (AGP1). The mRNA is cell-to-cell mobile.,,0,depleted,False,False,True,False,-1.4771727587255008,0.17870385300336553,1.4771727587255008,,,,,,False
AT5G20935,Chloroplast NADH dehydrogenase assembly protein. Mutants are defective in the accumulation of subcomplex A.,"AT5G20935:p, unknown protein; CONTAINS InterPro DOMAIN/s: Protein ...",0,depleted,False,False,True,False,-1.4731582738635356,0.0,1.4731582738635356,0.321928095,0.152003093,0.0,0.0,True,False
AT1G74450,Plants overexpressing At1g74450 are stunted in height and have reduced male fertility.,,0,depleted,False,False,True,False,-1.4731037591278213,-0.3911413581716567,1.4731037591278213,,,,,,False
AT1G28150,hypothetical protein;(source:Araport11),,0,depleted,False,True,True,False,-1.4716216935596012,1.360736558844796,1.4716216935596012,,,,,,False
AT1G16820,vacuolar ATP synthase catalytic subunit-related / V-ATPase-related / vacuolar proton pump-like protein;(source:Araport11),"AT1G16820:p, Vacuolar ATP synthase catalytic subunit-related / V-ATPase-related / vacuolar proton pump-like protein",0,depleted,False,False,True,False,-1.4700001440921593,0.0,1.4700001440921593,0.584962501,0.0,0.0,-0.584962501,True,False
AT4G15790,uveal autoantigen with coiled-coil/ankyrin;(source:Araport11),"AT4G15790:p, unknown protein; INVOLVED IN: biological_process ...",0,depleted,True,False,False,True,1.4535291681387006,-1.4698372779845787,1.4698372779845787,0.0,0.0,-1.321928095,-1.321928095,True,True
AT5G45070,phloem protein 2-A8;(source:Araport11),,0,depleted,False,False,True,False,-1.4691412597066256,-0.37176458880114477,1.4691412597066256,,,,,,False
AT2G26215,transposable_element_gene;(source:Araport11),,0,depleted,False,False,False,True,0.0,-1.4675103453706857,1.4675103453706857,,,,,,False
AT5G07571,Oleosin family protein;(source:Araport11),,0,depleted,False,False,True,False,-1.4636538421894196,0.0,1.4636538421894196,,,,,,False
AT3G55485,other_RNA;(source:Araport11),,0,depleted,False,False,True,False,-1.4603679641964726,-0.9795078780861285,1.4603679641964726,,,,,,False
AT5G53740,hypothetical protein;(source:Araport11),,0,depleted,False,False,True,True,-1.45958322480461,-1.308550767644523,1.45958322480461,,,,,,False
AT5G15750,Alpha-L RNA-binding motif/Ribosomal protein S4 family protein;(source:Araport11),,0,depleted,False,False,True,False,-1.4595813888390603,-0.5262836971122952,1.4595813888390603,,,,,,False
AT2G07705,hypothetical protein;(source:Araport11),,0,depleted,False,False,True,False,-1.4547934867125851,-0.8572390022789292,1.4547934867125851,,,,,,False
AT5G57000,DEAD-box ATP-dependent RNA helicase;(source:Araport11),,0,depleted,False,False,True,False,-1.4546663209037747,0.28872330658122464,1.4546663209037747,,,,,,False
AT2G07673,hypothetical protein;(source:Araport11),,0,depleted,False,False,False,True,-0.7066951774751705,-1.4498579277980295,1.4498579277980295,,,,,,False
AT1G74210,Encodes a member of the glycerophosphodiester phosphodiesterase (GDPD) family.,,0,depleted,False,False,True,False,-1.4482514469170693,-0.2795233358640032,1.4482514469170693,,,,,,False
AT2G07731,pseudogene of NADH dehydrogenase 6;(source:Araport11),,0,depleted,False,False,False,True,-0.9914444800783146,-1.4458159209399521,1.4458159209399521,,,,,,False
AT2G07697,"transposable_element_gene;(source:Araport11);non-LTR retrotransposon family (LINE), has a 1.9e-23 P-value blast match to GB:NP_038605 L1 repeat, Tf subfamily, member 30 (LINE-element) (Mus musculus);(source:TAIR10)",,0,depleted,False,False,False,True,-0.9154865445749721,-1.4431985257912103,1.4431985257912103,,,,,,False
AT1G22470,Hypothetical protein;(source:Araport11). Target of SR45.,,0,depleted,False,False,True,False,-1.4429129936128366,-0.6533706479801701,1.4429129936128366,,,,,,False
AT4G03610,Metallo-hydrolase/oxidoreductase superfamily protein;(source:Araport11),,0,depleted,False,False,True,False,-1.4401877703967716,0.0,1.4401877703967716,,,,,,False
AT5G03160,J domain protein localized in ER lumen. Can partially compensate for the growth defect in jem1 scj1 mutant yeast.,,0,depleted,False,True,True,False,-1.1482160398214165,1.4376336374933938,1.4376336374933938,,,,,,False
AT3G03280,PADRE protein up-regulated after infection by S. sclerotiorum.,,0,depleted,False,False,True,False,-1.4372666293554837,-0.10046534110335638,1.4372666293554837,,,,,,False
AT4G27380,hypothetical protein;(source:Araport11),"AT4G27380:p, AT4g27380/M4I22_190",0,depleted,False,False,False,True,-0.40349094889347803,-1.4359690319605491,1.4359690319605491,0.0,-1.321928095,0.0,0.0,True,False
AT1G76650,calmodulin-like 38;(source:Araport11),,0,depleted,False,False,True,False,-1.4350105752859679,0.30920427295031916,1.4350105752859679,,,,,,False
AT4G16146,cAMP-regulated phosphoprotein 19-related protein;(source:Araport11),,0,depleted,False,False,False,True,-0.6263821095805991,-1.4339163447145515,1.4339163447145515,,,,,,False
AT1G70440,Encodes a protein with similarity to RCD1 but without the WWE domain. The protein does have a PARP signature upstream of the C-terminal protein interaction domain. The PARP signature may bind NAD+ and attach the ADP-ribose-moiety from NAD+ to the target molecule. Its presence suggests a role for the protein in ADP ribosylation.,,0,depleted,False,False,False,True,0.6716407551755931,-1.433428741146364,1.433428741146364,,,,,,False
AT1G48550,"VPS26C is a component of a retromer complex, it is involved in endosome to lysosome protein transport and root hair growth.",,0,depleted,False,True,True,False,-1.4332456107070208,1.3238149610326746,1.4332456107070208,,,,,,False
AT1G77750,Ribosomal protein S13/S18 family;(source:Araport11),,0,depleted,False,False,True,False,-1.4320982646854779,0.48351605243142154,1.4320982646854779,,,,,,False
AT2G07766,"pre-tRNA tRNA-Ser (anticodon: TGA);(source:Araport11, TAIR10)",,0,depleted,False,False,True,False,-1.4318230375976584,-0.049079978949373645,1.4318230375976584,,,,,,False
AT2G07771,Cytochrome C assembly protein;(source:Araport11),,0,depleted,False,False,False,True,-0.8905554564842031,-1.4309740689962063,1.4309740689962063,,,,,,False
AT3G24010,ING1 encodes a member of the Inhibitor of Growth family of nuclear-localized PhD domain containing homeodomain proteins. Binds to H3K4 di or trimethylated DNA.,,0,depleted,False,True,True,False,-1.4298174870089684,1.1710524395945627,1.4298174870089684,,,,,,False
AT2G07786,pseudogene of NADH dehydrogenase 1A;(source:Araport11),,0,depleted,False,False,True,True,-1.0123189047428975,-1.4297347257366972,1.4297347257366972,,,,,,False
AT3G48520,"CYP94B3 is a jasmonoyl-isoleucine-12-hydroxylase that catalyzes the formation of 12-OH-JA-Ile from JA-Ile. By reducing the levels of this the biologically active phytohormone, CYP94B3 attenuates the jasmonic acid signaling cascade. CYP94B3 transcript levels rise in response to wounding.",,0,depleted,False,False,True,False,-1.429719889393117,-0.2541857577452884,1.429719889393117,,,,,,False
AT5G11340,"Encodes an N-terminal acetyltransferase involved in plant development and the suppression of stress responses, potentially through the regulation of ER stress.","AT5G11340:p, Acyl-CoA N-acyltransferases (NAT) superfamily protein ...",0,depleted,False,False,True,False,-1.4291987093453855,0.09874910740343669,1.4291987093453855,0.0,0.415037499,-0.584962501,-0.584962501,True,False
AT5G02710,zinc/iron-chelating domain protein;(source:Araport11),"AT5G02710:p,",0,depleted,False,False,True,False,-1.425855122919324,0.6563363708294423,1.425855122919324,0.584962501,-0.169925001,0.0,0.0,True,False
AT4G30140,Member of the GDSL lipase/esterase family of proteins that functions as cutinase. Expressed in pollen and at the zone of lateral root emergence.,,0,depleted,False,False,True,True,-1.425823474327588,-1.1748389085452633,1.425823474327588,,,,,,False
AT1G11870,Seryl-tRNA synthetase targeted to chloroplasts and mitochondria. Its inactivation causes developmental arrest of chloroplasts and mitochondria in Nicotiana benthamiana.,"SRS:p, Serine--tRNA ligase, chloroplastic/mitochondrial",0,depleted,False,False,True,False,-1.424966631258527,-0.4276661637624765,1.424966631258527,0.0,-0.169925001,-1.321928095,-1.0,True,False
AT4G14819,hypothetical protein (DUF1677);(source:Araport11),,0,depleted,False,False,False,True,0.42716203323652324,-1.4249133356082104,1.4249133356082104,,,,,,False
AT3G16020,F-box associated ubiquitination effector protein;(source:Araport11),,0,depleted,False,False,True,False,-1.4177037493274147,0.0,1.4177037493274147,,,,,,False
AT4G05440,Plays a role in pollen development and modulating DNA replication via interaction with MCM4 and MCM7 of the pre-replication complex.,,0,depleted,False,False,True,False,-1.4172371783036346,-0.6207923646241331,1.4172371783036346,,,,,,False
AT5G57300,S-adenosyl-L-methionine-dependent methyltransferases superfamily protein;(source:Araport11),,0,depleted,False,False,False,True,0.6222850515066999,-1.4116422913063884,1.4116422913063884,,,,,,False
AT2G07785,NADH dehydrogenase family protein;(source:Araport11),,0,depleted,False,False,False,True,-0.9941905330436047,-1.4080379974808246,1.4080379974808246,,,,,,False
AT5G05330,"Encodes a protein with a putative HMG-box domain.  The high-mobility group (HMG) proteins are chromatin-associated proteins that act as architectural factors in various nucleoprotein structures, which regulate DNA-dependent processes such as transcription and recombination.  Expression of this gene was not detected according to Grasser et al. (J. Mol. Biol. 2006:358, 654-664).",,0,depleted,False,False,True,False,-1.4051717148526208,0.0,1.4051717148526208,,,,,,False
AT4G37409,hypothetical protein;(source:Araport11),,0,depleted,False,False,False,True,0.0,-1.4048796945052313,1.4048796945052313,,,,,,False
AT2G07756,"pre-tRNA tRNA-Gly (anticodon: GCC);(source:Araport11, TAIR10)",,0,depleted,False,False,False,True,-0.612380227431632,-1.4038378424264253,1.4038378424264253,,,,,,False
AT1G66820,glycine-rich protein;(source:Araport11),,0,depleted,False,False,False,True,0.9864999911437271,-1.4032818874765265,1.4032818874765265,,,,,,False
AT2G07663,Pseudogene of AT2G07776,,0,depleted,False,False,True,True,-1.1885578116222486,-1.4005933779366577,1.4005933779366577,,,,,,False
AT5G51580,hypothetical protein;(source:Araport11),,0,depleted,False,False,True,False,-1.398037551830415,0.9358236759429402,1.398037551830415,,,,,,False
AT2G07716,pseudogene of Sec-independent periplasmic protein translocase;(source:Araport11),,0,depleted,False,False,True,True,-1.1794186024883941,-1.3971243502634125,1.3971243502634125,,,,,,False
AT1G10390,"DRA2 is a homolog of mammalian nucleoporin 98 and a likely component of the nuclear pore complex in Arabidopsis. It positively participates in the control of the hypocotyl elongation response to plant proximity and control of shade induced gene expression. Nucleoportin which redundantly inhibits flowering together with Nup98b through multiple pathways including clock, photoperiod, and age pathways. Gates flowering in a CONSTANS (CO)-independent mode and bypasses the CO checkpoint in photoperiodic signaling and integrated signals from multiple pathways to directly target FLOWERING LOCUS T (FT) for flowering control.","AT1G10390:p, Nuclear pore complex protein NUP98A",0,depleted,False,False,True,False,-1.395129726951051,0.5202403733790055,1.395129726951051,1.0,0.0,-1.415037499,0.945552216,True,False
AT1G02816,"pectinesterase (Protein of unknown function, DUF538);(source:Araport11)","AT1G02816:p, F22D169 protein",0,depleted,False,False,True,False,-1.3948348590056225,0.007350190603060244,1.3948348590056225,0.0,0.0,-0.415037499,0.668794092,True,False
AT5G43620,Pre-mRNA cleavage complex II;(source:Araport11),,0,depleted,False,False,True,True,-1.3927526388303766,-1.188724693325869,1.3927526388303766,,,,,,False
AT1G18030,Protein phosphatase 2C family protein;(source:Araport11),,0,depleted,True,False,False,True,1.194011643699453,-1.3889430123096915,1.3889430123096915,,,,,,False
AT4G34860,Plant neutral invertase family protein;(source:Araport11),,0,depleted,False,False,True,False,-1.3885937623062243,0.7675746799286226,1.3885937623062243,,,,,,False
AT1G20225,Thioredoxin superfamily protein;(source:Araport11),,0,depleted,False,False,True,False,-1.388552248005026,0.6514043268750234,1.388552248005026,,,,,,False
AT1G78915,Tetratricopeptide repeat (TPR)-like superfamily protein;(source:Araport11),"AT1G78915:p, Tetratricopeptide repeat (TPR)-like superfamily protein",0,depleted,False,False,True,False,-1.3866674332714668,0.27735897141007926,1.3866674332714668,-0.584962501,-0.169925001,-4.882643049,-5.087462841,False,False
AT1G07960,"Encodes a protein disulfide isomerase-like (PDIL) protein, a member of a multigene family within the thioredoxin (TRX) superfamily.","PDIL5-1:p, PDIL5-1",0,depleted,False,False,True,False,-1.3860966050889238,0.0032089616241598486,1.3860966050889238,1.321928095,0.222392421,0.0,0.0,True,False
AT1G76878,Natural antisense transcript overlaps with AT1G76880;(source:Araport11),,0,depleted,False,False,True,False,-1.386080862904297,0.0,1.386080862904297,,,,,,False
AT3G46560,"Encodes a small zinc finger-like protein that is a component of the mitochondrial protein import apparatus.  Together with AtTIM10, AtTIM9 is non-redundantly essential for maintaining mitochondrial function of early embryo proper cells and endosperm free-nuclei.",,0,depleted,False,False,False,True,0.485733631513689,-1.385020272929811,1.385020272929811,,,,,,False
AT2G07799,Pseudogene of ATMG00260,,0,depleted,False,False,False,True,-0.9792414110847448,-1.384290192097332,1.384290192097332,,,,,,False
AT2G07727,cytochrome b;(source:Araport11),,0,depleted,False,False,False,True,-0.9618169290180066,-1.383913170073659,1.383913170073659,,,,,,False
AT5G49170,hypothetical protein;(source:Araport11),,0,depleted,False,False,True,False,-1.3833778810136863,0.9612958604660463,1.3833778810136863,,,,,,False
AT5G42900,Acts with COR28 as a key regulator in the COP1-HY5 regulatory hub by regulating HY5 activity to ensure proper skotomorphogenic growth in the dark and photomorphogenic development in the light.,,0,depleted,False,False,True,False,-1.3785879137490038,-0.6974901913199083,1.3785879137490038,,,,,,False
AT5G52020,encodes a member of the DREB subfamily A-4 of ERF/AP2 transcription factor family. The protein contains one AP2 domain. There are 17 members in this subfamily including TINY.,,0,depleted,False,False,True,False,-1.3783129615668468,0.23292041852877968,1.3783129615668468,,,,,,False
AT2G18245,alpha/beta-Hydrolases superfamily protein;(source:Araport11),,0,depleted,False,False,False,True,0.5629871831685501,-1.377914445881581,1.377914445881581,,,,,,False
AT5G61220,LYR family of Fe/S cluster biogenesis protein;(source:Araport11),"AT5G61220:p, At5g61220",0,depleted,False,False,True,False,-1.3768926772522037,-0.8019797443344017,1.3768926772522037,0.0,0.0,-0.584962501,0.0,True,False
