geneID,description_rna,description_prot,class,condition,enriched_NS_RNA,enriched_HS_RNA,depleted_NS_RNA,depleted_HS_RNA,rna_log2FC_NS,rna_log2FC_HS,strongest_rna_log2fc,log2FC_AP_NS,log2FC_AP_HS,log2FC_PDL_NS,log2FC_PDL_HS,protein_enriched,conflict_resolved
AT5G27030,TOPLESS family member involved in the negative regulation of SNC1-dependent phenotypes.,"TPR3:p, TOPLESS-related 3",1,HS,False,True,False,False,0.009299971849045716,1.3725695321418752,1.3725695321418752,0.0,0.0,-1.0,0.0,True,False
AT5G55160,"Encodes a small ubiquitin-like modifier (SUMO) polypeptide that becomes covalently attached to various intracellular protein targets, much like ubiquitination, leading to post-translational modification of those targets. SUMO2 can form SUMO chains through lysine residue 10 during in vitro assays.","SUMO2:p, Small ubiquitin-related modifier",1,HS,False,True,False,False,0.6163790684158962,1.3707047010714213,1.3707047010714213,0.0,-0.584962501,-0.584962501,0.0,True,False
AT1G58110,Basic-leucine zipper (bZIP) transcription factor family protein;(source:Araport11),"AT1G58110:p, Basic-leucine zipper (BZIP) transcription factor ...",1,HS,False,True,False,False,-0.4043876155154961,1.3699510874738825,1.3699510874738825,0.0,0.0,-0.514573173,0.929610672,True,False
AT5G11840,"YCF36, putative (DUF1230);(source:Araport11)","AT5G11840:p, At5g11840",1,NS,True,False,False,False,1.368179910392795,0.5116149840377853,1.368179910392795,0.0,0.0,-1.0,-1.0,True,False
AT4G14990,Topoisomerase II-associated protein PAT1;(source:Araport11),"AT4G14990:p, Protein PAT1 homolog 2",1,HS,False,True,False,False,0.7810123094087406,1.3681439272815563,1.3681439272815563,0.0,0.0,0.0,1.584962501,True,False
AT4G25840,glycerol-3-phosphatase 1;(source:Araport11),"GPP1:p, (DL)-glycerol-3-phosphatase 1, mitochondrial",1,HS,False,True,False,False,0.756299549504488,1.366557449036995,1.366557449036995,0.584962501,-0.584962501,0.0,0.736965594,True,False
AT5G14790,ARM repeat superfamily protein;(source:Araport11),"AT5G14790:p, ARM repeat superfamily protein",1,HS,False,True,False,False,0.7326602349132432,1.3662527990641133,1.3662527990641133,0.0,-0.584962501,0.0,0.0,True,False
AT4G08540,DNA-directed RNA polymerase II protein;(source:Araport11),"AT4G08540:p, DNA-directed RNA polymerase II protein",1,HS,False,True,False,False,0.3029258387441551,1.3651681563430498,1.3651681563430498,0.0,0.0,-0.584962501,0.415037499,True,False
AT5G67560,"A member of ARF-like GTPase family. A thaliana has 21 members, in two subfamilies, ARF and ARF-like (ARL) GTPases. Possible pseudogene because it lacks an N-terminal part that is conserved among the other ARL8 proteins. The mRNA is cell-to-cell mobile.","ARLA1D:p, ADP-ribosylation factor-like protein 8b",1,HS,False,True,False,False,0.40578044898483284,1.3648721381920408,1.3648721381920408,-0.321928095,-0.584962501,0.0,0.0,True,False
AT5G58490,NAD(P)-binding Rossmann-fold superfamily protein;(source:Araport11),"AT5G58490:p, Cinnamoyl-CoA reductase-like protein",1,HS,False,True,False,False,-0.5682299075257256,1.3644427238643462,1.3644427238643462,0.0,-1.032421478,0.0,0.0,True,False
AT3G52590,Ubiquitin extension protein The mRNA is cell-to-cell mobile.,"UBQ1:p, Ubiquitin-60S ribosomal protein L40-1",1,HS,False,True,False,False,0.7748264846827033,1.3642315855500187,1.3642315855500187,0.0,-1.0,0.637429921,0.289506617,True,False
AT1G79200,Encodes a nuclear localized protein involved in auxin-dependent control of cell proliferation in pistil development. Loss of function mutations have increased cell proliferation in the stigma.,"AT1G79200:p, SCI1",1,both,True,True,False,False,1.0568449931479984,1.3641675804797004,1.3641675804797004,0.0,0.0,0.0,0.415037499,True,False
AT3G55610,"encodes delta 1-pyrroline-5-carboxylate synthetase B. Gene expression is induced by dehydration, high salt and ABA. Knock-out mutations in P5CS2 are embryo-lethal. P5CS2 appears to be present in different cells and/or different subcellular locations from P5CS1 in a tissue-dependent manner.   Mutants are defective in pollen development.","P5CS2:p, Delta-1-pyrroline-5-carboxylate synthase",1,HS,False,True,False,False,-0.031682893499501756,1.3595872926681307,1.3595872926681307,0.04580369,0.2410081,0.485426827,0.0,True,False
AT1G01910,Subunit of GET complex. Interacts with GET2 in the presence of GET1.,"AT1G01910:p, ATPase",1,HS,False,True,False,False,0.8902200923571347,1.3590052271723074,1.3590052271723074,0.415037499,0.152003093,0.0,0.0,True,False
AT5G05000,Outer membrane GTPase protein that may function in import of nuclear encoded proteins into the chloroplast. Phosphorylation of the G-domains regulate translocon assembly.,"TOC34:p, Translocase of chloroplast 34, chloroplastic",1,HS,False,True,False,False,-0.5724479588297672,1.3586078555963912,1.3586078555963912,0.0,0.0,-1.736965594,-1.807354922,True,False
AT4G29490,Metallopeptidase M24 family protein;(source:Araport11),"AT4G29490:p, Metallopeptidase M24 family protein",1,HS,False,True,False,False,0.8271420381935198,1.358541987052016,1.358541987052016,1.0,0.736965594,0.0,0.0,True,False
AT2G39940,"Encodes a protein containing Leu-rich repeats  and a degenerate F-box motif. Associates with AtCUL1, AtRbx1, and the Skp1-like proteins ASK1 and ASK2 to assemble SCF COI1 ubiquitin-ligase complexes in planta. A single amino acid substitution in the F-box motif of COI1 abolishes the formation of the SCF(COI1) complexes and results in loss of the JA response. Required for wound- and jasmonates-induced transcriptional regulation. Amino acid mutations  in COI1 distinctively affect jasmonate-regulated male fertility.CFA-Ile, CFA-Leu, CFA-Val, CFA-Met and CFA-Ala could not inhibit the root length and restoration of fertility in coi1-1 mutants.","COI1:p, Coronatine-insensitive protein 1",1,HS,False,True,False,False,0.19129368124502688,1.357789883658823,1.357789883658823,-0.847996907,-0.710493383,0.0,0.0,True,False
AT5G43600,"Encodes a protein with ureidoglycolate amidohydrolase activity in vitro. It is 27% identical and 43% similar to the E. coli allantoate amidohydrolase (AAH), but, in vitro assays with purified protein and allantoate as a substrate do not show any increase in ammonium concentration, indicating that there this enzyme has no AAH activity. The mRNA is cell-to-cell mobile.","UAH:p, Ureidoglycolate hydrolase",1,HS,False,True,False,False,0.028388312114288942,1.3541166963940312,1.3541166963940312,0.584962501,0.415037499,0.0,0.0,True,False
AT3G26740,transcripts are  differentially regulated at the level of mRNA stability at different times of day controlled by the circadian clock. mRNAs are targets of the mRNA degradation pathway mediated by the downstream (DST) instability determinant.,"CCL:p, Light-regulated protein 1, chloroplastic",1,HS,False,True,False,False,0.5122987227204656,1.3540733490797447,1.3540733490797447,-0.415037499,-0.392317423,0.0,-1.0,True,False
AT5G64480,hypothetical protein;(source:Araport11),"AT5G64480:p,",1,NS,True,False,False,True,1.3537503898933503,-1.2729765235389705,1.3537503898933503,0.0,0.0,-2.0,-2.906890596,True,True
AT3G25110,Encodes a FatA acyl-ACP thioesterase,"FaTA:p, Oleoyl-acyl carrier protein thioesterase 1, chloroplastic ...",1,NS,True,False,False,False,1.3518371994906098,0.38626877855482233,1.3518371994906098,0.0,0.0,-0.584962501,-1.0,True,False
AT1G06760,winged-helix DNA-binding transcription factor family protein;(source:Araport11),"AT1G06760:p, Histone H1",1,HS,False,True,False,False,0.22837876296766943,1.3515437969091015,1.3515437969091015,0.321928095,-0.362570079,0.0,0.0,True,False
AT4G19840,"encodes a phloem lectin, similar to phloem lectin in cucumber and celery. Gene is expressed in the phloem, predominantly in the companion cells. The mRNA is cell-to-cell mobile.","PP2-A1:p, Protein PHLOEM PROTEIN 2-LIKE A1",1,HS,False,True,False,False,0.7021107087889172,1.3512531909299326,1.3512531909299326,0.0,0.0,0.0,0.736965594,True,False
AT5G57960,"GTP-binding protein, HflX;(source:Araport11)","AT5G57960:p, GTP binding protein-like",1,HS,False,True,False,False,-0.8919326913816452,1.3506994145692706,1.3506994145692706,0.0,-0.169925001,-2.700439718,-2.169925001,True,False
AT3G01120,"encodes a cystathionine gamma-synthase, which performs the first committed step in methionine biosynthesis. A conserved motif of 13 amino acids in the first exon is required for posttranscriptional autoregulation. This enzyme shares the same substrate as threonine synthase (TS) and its absence transcriptionally affects 8 genes in the genome.","MTO1:p, MTO1",1,both,True,True,False,False,1.01418366357428,1.3489277852963506,1.3489277852963506,-1.0,0.152003093,-3.832890014,-4.554588852,True,False
AT2G19385,zinc ion binding protein;(source:Araport11),"AT2G19385:p, At2g19385",1,NS,True,False,False,False,1.3482491353654076,0.2606616268154172,1.3482491353654076,0.0,0.637429921,0.0,0.0,True,False
AT5G08180,Ribosomal protein L7Ae/L30e/S12e/Gadd45 family protein;(source:Araport11),"AT5G08180:p, H/ACA ribonucleoprotein complex subunit 2-like protein ...",1,NS,True,False,False,False,1.3474148942994755,0.34307378057444254,1.3474148942994755,-0.125530882,0.125530882,0.0,0.0,True,False
AT3G63130,"Encodes a RAN GTPase activating protein involved in nuclear import, cell plate formation and mitotic spindle formation. Associates with nuclear envelope membranes.","RANGAP1:p, RAN GTPase-activating protein 1",1,HS,False,True,False,False,-0.4878575945391967,1.347354878293679,1.347354878293679,0.0,0.0,-1.0,-0.584962501,True,False
AT1G49750,Leucine-rich repeat (LRR) family protein;(source:Araport11),"AT1G49750:p, AT1G49750 protein",1,both,True,True,False,False,1.302433607796116,1.3453737947637232,1.3453737947637232,-0.637429921,0.067114196,1.0,0.0,True,False
AT5G05470,Encodes an eIF2alpha homolog that can be phosphorylated by GCN2 in vitro.,"EIF2 ALPHA:p, Eukaryotic translation initiation factor 2 subunit ...",1,NS,True,False,False,False,1.3450366503790538,0.16291972389462872,1.3450366503790538,0.584962501,0.415037499,0.0,0.0,True,False
AT5G04900,Encodes a chlorophyll b reducatase involved in the degradation of chlorophyll b and LHCII (light harvesting complex II).,"NOL:p, Chlorophyll(ide) b reductase NOL, chloroplastic",1,NS,True,False,False,False,1.3443240335363629,-0.5815033021076188,1.3443240335363629,0.0,0.0,-0.584962501,0.0,True,False
AT5G52810,SAR-DEFICIENT4 (SARD4) alias ORNITHINE CYCLODEAMINASE/m-CRYSTALLIN (ORNCD1) is involved in the biosynthesis of pipecolic acid. The reductase converts dehydropipecolic acid intermediates generated from L-Lysine by AGD2-LIKE DEFENSE RESPONSE PROTEIN1 (ALD1) to pipecolic acid (PMID:28330936).,"AT5G52810:p, Protein SAR DEFICIENT 4",1,NS,True,False,False,False,1.344219535870413,0.8710885982287148,1.344219535870413,0.371968777,-0.023083613,0.0,0.0,True,False
AT2G40140,zinc finger (CCCH-type) family protein;(source:Araport11),"CZF1:p, Zinc finger CCCH domain-containing protein 29",1,HS,False,True,False,False,-0.16830318284007065,1.3421309092741718,1.3421309092741718,0.0,0.0,0.584962501,1.584962501,True,False
AT5G62930,SGNH hydrolase-type esterase superfamily protein;(source:Araport11),"AT5G62930:p, SGNH hydrolase-type esterase superfamily protein ...",1,HS,False,True,False,False,0.007977949707975137,1.3421152028756411,1.3421152028756411,0.415037499,0.552541023,0.0,0.0,True,False
AT4G14030,selenium-binding protein 1;(source:Araport11),"SBP1:p, Selenium-binding protein 1",1,HS,False,True,False,False,-0.5206758380573646,1.3417949930387614,1.3417949930387614,-0.074000581,0.047305715,2.169925001,-0.584962501,True,False
AT2G14750,"Encodes adenosine-5'-phosphosulfate kinase. Provides activated sulfate for  sulfation of secondary metabolites, including the glucosinolates. Essential for pollen viability. The mRNA is cell-to-cell mobile.","APK:p, Adenylyl-sulfate kinase",1,NS,True,False,False,False,1.340368020594386,0.8641829304143708,1.340368020594386,0.0,0.793549123,-2.584962501,-2.321928095,True,False
AT1G26670,member of VTI1 Gene Family. Normally localizes to the transgolgi network and plasma membrane. A dominant mutation  (zip1) alters the subcellular localization of VTI12 and suppresses loss of function mutation (zag1) of VTI11. Interacts with members of the SYP family. Involved in protein trafficking to protein storage vacuoles.,"VTI1B:p, VTI1B",1,HS,False,True,False,False,0.5169810094051079,1.338542686763741,1.338542686763741,0.0,0.0,0.0,0.0,True,False
AT1G08570,"Encodes a member of the thioredoxin family protein.  Located in the chloroplast.  Shows high activity towards the chloroplast 2-Cys peroxiredoxin A, and poor activity towards the chloroplast NADP-malate   dehydrogenase. The mRNA is cell-to-cell mobile.","ACHT4:p,",1,NS,True,False,False,False,1.337185049251602,0.7330094640589296,1.337185049251602,0.0,-0.169925001,0.0,0.0,True,False
AT2G34470,Encodes a urease accessory protein which is essential for the activation of plant urease.,"UREG:p, Urease accessory protein G",1,NS,True,False,False,False,1.3370973934607326,0.19993683058924067,1.3370973934607326,0.678071905,0.263034406,-0.222392421,-0.432959407,True,False
AT3G55005,"Encodes a protein of unknown function that is involved in cortical microtubule organization. Mutants exhibit abnormal cell growth and patterns of division. TON1B appears to be redundant with TON1A. Encodes a novel protein that is similar to human FOP and OFD1 centrosomal proteins. Localizes to the preprophase band, cytoplasm and cell cortex where it is probably associated with the cortical cytoskeleton. TON1B associates with plant centrin CEN1.","TON1B:p, Protein TONNEAU 1b",1,HS,False,True,False,False,0.10370517188936343,1.3369601787275118,1.3369601787275118,0.0,0.0,0.0,0.415037499,True,False
AT1G56500,"Encodes a thylakoid membrane protein with thioredoxin-like and beta-propeller domains located in the lumen and a haloacid-dehalogenase domain exposed to the chloroplast stroma. The protein's role may be to prevent formation of a slowly reversible form of antenna quenching, thereby maintaining the efficiency of light harvesting. The mRNA is cell-to-cell mobile.","AT1G56500:p, Protein SUPPRESSOR OF QUENCHING 1, chloroplastic ...",1,HS,False,True,False,False,0.2266647417966757,1.3356435346258848,1.3356435346258848,-0.874469118,-0.584962501,0.362570079,-2.321928095,True,False
AT4G34920,PLC-like phosphodiesterases superfamily protein;(source:Araport11),"AT4G34920:p, AT4g34920/F11I11_160",1,HS,False,True,False,False,0.3511562769809798,1.3332234544841093,1.3332234544841093,-0.584962501,0.415037499,0.0,0.0,True,False
AT3G23540,alpha/beta-Hydrolases superfamily protein;(source:Araport11),"AT3G23540:p, Alpha/beta-Hydrolases superfamily protein",1,HS,False,True,False,False,0.6178777943578807,1.3325545540767372,1.3325545540767372,0.0,0.0,-0.152003093,0.552541023,True,False
AT3G22890,"encodes ATP sulfurylase, the first enzyme in the sulfate assimilation pathway of Arabidopsis. It may also participate in selenium metabolism. The mRNA is cell-to-cell mobile.","APS1:p, ATP sulfurylase 1, chloroplastic",1,both,True,True,False,False,1.0519076708522301,1.3321269338509114,1.3321269338509114,0.222392421,0.043068722,0.251538767,-1.584962501,True,False
AT5G43970,"Subunit of the TOM complex, a translocase in the outer mitochondrial membrane that selectively allows proteins with a mitochondrial targeting sequence to enter the mitochondrion.","TOM22-V:p, TOM9-2",1,HS,False,True,False,False,0.3778858628101473,1.3320890289025635,1.3320890289025635,0.0,0.736965594,0.0,-1.321928095,True,False
AT3G02630,"One of seven acyl acyl carrier proteins. Expressed primarily in developing seeds.Involved in fatty acid metabolism. Redundant &#916;9 stearoyl-ACP desaturase gene which together with FAB2 and AAD1 during embryo development provide precursors for the elaboration of embryo cuticle and therefore plays a specific role during the phase of invasive embryo growth through the endosperm. Together with FAB2, AAD5, and AAD6 redundantly participates in oil storage during the maturation phase.","AT3G02630:p, Stearoyl- 9-desaturase 5, chloroplastic",1,HS,False,True,False,False,0.49702128532305423,1.3310502443154526,1.3310502443154526,0.0,0.415037499,0.0,0.0,True,False
AT5G52440,HCF106; nuclear gene for chloroplast. Thylakoid membrane delta pH translocation pathway component protein; related to Escherichia coli TatA and TatB The mRNA is cell-to-cell mobile.,"HCF106:p, Sec-independent protein translocase protein TATB, chloroplastic ...",1,NS,True,False,False,False,1.3304008185639908,0.7569930609798484,1.3304008185639908,0.0,0.0,0.0,-0.584962501,True,False
AT4G00100,Encodes a cytoplasmic ribosomal protein S13 homologue involved in early leaf development The mRNA is cell-to-cell mobile.,"RPS13A:p, 40S ribosomal protein S13-2",1,HS,False,True,False,False,0.6920569214586287,1.3299104172909932,1.3299104172909932,0.485426827,-0.078002512,0.0,0.251538767,True,False
AT2G05830,Encodes a 5-methylthioribose-1-phosphate isomerase.,"AT2G05830:p, Methylthioribose-1-phosphate isomerase",1,NS,True,False,False,False,1.3298928747719991,0.8300136268780594,1.3298928747719991,-0.584962501,-0.584962501,0.415037499,1.415037499,True,False
AT3G63250,"Encodes a homocysteine methyltransferase (HMT). Among the three HMT coding genes in the genome, HMT2 is responsible for a significant proportion of HMT activity in the flower stalks and silique hulls. However, HMT2 does not significantly contribute to the total HMT activity in seeds.","HMT2:p, Homocysteine S-methyltransferase 2",1,HS,False,True,False,False,-0.03834985653161797,1.3284018051802406,1.3284018051802406,0.0,0.736965594,0.0,0.0,True,False
AT3G59600,"One of two highly similar proteins that can serve as non-catalytic subunits of Nuclear RNA polymerases II, IV and V; homologous to budding yeast  RPB8.  Probably redundant with At1g54250.","NRPB8B:p, DNA-directed RNA polymerases II, IV and V subunit 8B ...",1,NS,True,False,False,False,1.3281372417574366,0.7156422831016865,1.3281372417574366,0.0,0.415037499,0.0,1.0,True,False
AT4G36940,nicotinate phosphoribosyltransferase 1;(source:Araport11),"NAPRT1:p, NAPRT1",1,NS,True,False,False,False,1.3278089247921006,0.22898258030360466,1.3278089247921006,0.678071905,-0.156119202,1.0,0.0,True,False
AT5G23580,Member of a unique family of enzymes containing a single polypeptide chain with a kinase domain at the amino terminus and a putative calcium-binding EF hands structure at the carboxyl terminus; recombinant protein is fully active and induced by Ca2+,"CDPK9:p, Calcium-dependent protein kinase 12",1,NS,True,False,False,False,1.3272107937624182,0.4463033483342906,1.3272107937624182,0.0,0.0,0.0,0.415037499,True,False
AT4G31500,Encodes an oxime-metabolizing enzyme in the biosynthetic pathway of glucosinolates.  Is required for phytochrome signal transduction in red light.   Mutation confers auxin overproduction.,"CYP83B1:p, Cytochrome P450 83B1",1,HS,False,True,False,False,0.9486533806147732,1.3267951919837122,1.3267951919837122,0.0,0.415037499,0.0,0.0,True,False
AT3G19900,hypothetical protein;(source:Araport11),"AT3G19900:p, AT3G19900 protein",1,NS,True,False,False,False,1.3266501426685702,0.5175822875147749,1.3266501426685702,0.874469118,-0.584962501,-3.64385619,-3.64385619,True,False
AT2G40880,"Encodes a protein with cysteine proteinase inhibitor activity. Overexpression increases tolerance to abiotic stressors (i.e.salt,osmotic, cold stress). The mRNA is cell-to-cell mobile.","CYSA:p, Cysteine proteinase inhibitor",1,HS,False,True,False,False,0.5450091940006948,1.3261704237643295,1.3261704237643295,0.584962501,-0.169925001,0.0,0.0,True,False
AT2G37040,"Encodes PAL1, a phenylalanine ammonia-lyase.  Arabidopsis has four PALs: AT2G37040 (PAL1), AT3G53260 (PAL2), AT5G04230 (PAL3) and AT3G10340 (PAL4).","PAL1:p, Phenylalanine ammonia-lyase 1",1,both,True,True,False,False,1.1323958708213038,1.322507611912971,1.322507611912971,0.0,-1.0,-0.362570079,0.985353224,True,False
AT5G39730,AIG2-like (avirulence induced gene) family protein;(source:Araport11),"AT5G39730:p, AIG2-like protein B",1,NS,True,False,False,False,1.3223126363481403,0.8738058472020599,1.3223126363481403,0.584962501,0.736965594,0.0,0.0,True,False
AT3G06410,Zinc finger C-x8-C-x5-C-x3-H type family protein;(source:Araport11),"AT3G06410:p, Zinc finger CCCH domain-containing protein 34",1,HS,False,True,False,False,-0.5899625909844728,1.3205651148428368,1.3205651148428368,0.415037499,0.222392421,0.0,0.0,True,False
AT3G07300,NagB/RpiA/CoA transferase-like superfamily protein;(source:Araport11),"AT3G07300:p, AT3G07300 protein",1,HS,False,True,False,False,-0.346239222118533,1.3205521156208444,1.3205521156208444,0.0,0.0,-1.0,-1.0,True,False
AT5G17870,plastid-specific ribosomal protein 6 precursor (Psrp-6) - like,"PSRP6:p, plastid-specific 50S ribosomal protein 6",1,HS,False,True,False,False,0.23832447877115903,1.3204544723285303,1.3204544723285303,-1.415037499,-0.321928095,0.222392421,-0.584962501,True,False
AT2G37080,"Encodes RIP2 (ROP interactive partner 2), a putative Rho protein effector, interacting specifically with the active form of ROPs (Rho proteins of plants).","RIP3:p, Interactor of constitutive active ROPs 2, chloroplastic ...",1,HS,False,True,False,False,0.08241021279498878,1.3196733464925652,1.3196733464925652,0.0,0.0,0.0,-2.459431619,True,False
AT5G43280,"Encodes the peroxisomal delta 3,5-delta2,4-dienoyl-CoA isomerase, a enzyme involved in degradation of unsaturated fatty acids. Gene expression is induced upon seed germination.","DCI1:p, Delta(3,5)-Delta(2,4)-dienoyl-CoA isomerase, peroxisomal ...",1,HS,False,True,False,False,-0.09624712210687275,1.3192782069029996,1.3192782069029996,-0.321928095,-0.392317423,-0.584962501,0.0,True,False
AT3G46040,Regulated by TCP20. The mRNA is cell-to-cell mobile.,"RPS15AD:p, RPS15AD",1,HS,False,True,False,False,0.8264043674226825,1.3182517321724303,1.3182517321724303,0.0,0.0,0.0,0.415037499,True,False
AT1G33810,zinc finger/BTB domain protein;(source:Araport11),"AT1G33810:p, Zinc finger/BTB domain protein",1,HS,False,True,False,False,0.9637794691559275,1.3175528460027346,1.3175528460027346,-0.584962501,0.0,-1.0,-2.0,True,False
AT1G78620,"integral membrane protein (Protein of unknown function DUF92, transmembrane);(source:Araport11)","AT1G78620:p, Uncharacterized transmembrane protein",1,both,True,True,False,False,1.1899178412819158,1.317099408309608,1.317099408309608,0.0,0.0,0.0,-0.584962501,True,False
AT5G51830,"Encodes one of the several Arabidopsis fructokinases. Nomenclature according to Riggs 2017 has been adopted for the family by the community (personal communication, Boernke, Callis, Granot, Boernke, and Smeekens). Important for seed oil accumulation and vascular development.","AT5G51830:p, Probable fructokinase-7",1,NS,True,False,False,False,1.3166632476429265,0.10227516170766635,1.3166632476429265,0.0,0.0,-1.321928095,-1.0,True,False
AT5G47770,Encodes a protein with farnesyl diphosphate synthase activity.,"FPS1:p, Farnesyl pyrophosphate synthase 1, mitochondrial",1,HS,False,True,False,False,-0.40808798788182155,1.3164473018210041,1.3164473018210041,-0.415037499,1.222392421,1.584962501,0.0,True,False
AT1G12900,glyceraldehyde 3-phosphate dehydrogenase A subunit 2;(source:Araport11),"GAPA-2:p, glyceraldehyde 3-phosphate dehydrogenase A subunit 2",1,HS,False,True,False,False,-0.19228282228069152,1.3148619714228416,1.3148619714228416,-0.108524457,0.03170886,-0.392317423,0.366127899,True,False
AT5G06360,Ribosomal protein S8e family protein;(source:Araport11),"AT5G06360:p, Ribosomal protein S8e family protein",1,HS,False,True,False,False,0.7997400320391022,1.310819425006198,1.310819425006198,-0.415037499,0.289506617,0.0,0.0,True,False
AT1G22940,"Encodes a bifunctional enzyme required for thiamine (vitamin B1) biosynthesis. TH1 can phosphorylate HMP-P to produce HMP-PP, the pyrimidine heterocyclic subunit of thiamine. TH1 also catalyzes the condensation of HMP-PP and HET to form thiamine monophosphate (TMP). TH1 also appears capable of phosphorylating HMP based on E.coli mutant complementation assays. th1 mutants are thiamine auxotrophs that die as seedlings on unsupplemented media.","TH1:p, Thiamine biosynthetic bifunctional enzyme TH1, chloroplastic ...",1,NS,True,False,False,False,1.3101424591880897,0.8671759185922577,1.3101424591880897,-0.070389328,-0.090197809,0.584962501,0.0,True,False
AT1G20810,FKBP-like peptidyl-prolyl cis-trans isomerase family protein;(source:Araport11),"AT1G20810:p, Peptidyl-prolyl cis-trans isomerase FKBP18, chloroplastic ...",1,HS,False,True,False,False,-0.492494203410446,1.309910332039211,1.309910332039211,0.415037499,1.0,0.0,0.0,True,False
AT5G64370,"PYD3 encodes a beta-ureidopropionase which, when expressed in E. coli, has been shown to convert beta-ureidopropionate into beta-alanine. It localizes to the cytosol and plays an important role in uracil degradation.","BETA-UP:p, Beta-ureidopropionase",1,HS,False,True,False,False,-0.13337731881120443,1.308563366397404,1.308563366397404,1.321928095,-0.321928095,0.0,0.0,True,False
AT1G16080,nuclear protein;(source:Araport11),"AT1G16080:p, Nuclear protein",1,HS,False,True,False,False,0.6386816171214063,1.3078785833552389,1.3078785833552389,0.485426827,0.502500341,3.700439718,0.0,True,False
AT5G19940,Enables plants to cope with moderate light stress and affects cadmium tolerance.,"AT5G19940:p, Probable plastid-lipid-associated protein 8, chloroplastic ...",1,HS,False,True,False,False,0.23282282344368832,1.3072361074324825,1.3072361074324825,0.736965594,0.736965594,0.0,0.0,True,False
AT2G30050,transducin family protein / WD-40 repeat family protein;(source:Araport11),"AT2G30050:p, Protein transport protein SEC13 homolog B",1,HS,False,True,False,False,-0.3860116315065338,1.3068100244519592,1.3068100244519592,0.222392421,-0.125530882,0.0,0.0,True,False
