geneID,description_rna,description_prot,class,condition,enriched_NS_RNA,enriched_HS_RNA,depleted_NS_RNA,depleted_HS_RNA,rna_log2FC_NS,rna_log2FC_HS,strongest_rna_log2fc,log2FC_AP_NS,log2FC_AP_HS,log2FC_PDL_NS,log2FC_PDL_HS,protein_enriched,conflict_resolved
AT5G59210,myosin heavy chain-like protein;(source:Araport11),"AT5G59210:p, AT5g59210/mnc17_100",1,NS,True,False,False,False,1.131743556721298,0.7768151171931491,1.131743556721298,0.0,0.0,-1.807354922,-1.169925001,True,False
AT4G24800,MA3 domain-containing protein;(source:Araport11),"AT4G24800:p, ECIP1",1,HS,False,True,False,False,0.5412432137573681,1.1314997508364613,1.1314997508364613,0.0,-0.584962501,-1.058893689,-1.291231298,True,False
AT5G47710,Calcium-dependent lipid-binding (CaLB domain) family protein;(source:Araport11),"AT5G47710:p, Protein C2-DOMAIN ABA-RELATED 11",1,HS,False,True,False,False,0.19095114111132788,1.131089047790949,1.131089047790949,0.395928676,0.213403638,0.415037499,0.0,True,False
AT3G08670,serine/arginine repetitive matrix-like protein;(source:Araport11),"AT3G08670:p, At3g08670",1,HS,False,True,False,False,0.638665007617606,1.1301763337655821,1.1301763337655821,0.0,0.0,-1.0,1.180572246,True,False
AT1G73840,"Resembles the CstF64 family of RNA processing factors that are conserved between yeast and mammals.  In mammals, CstF64 is a component of the CstF complex which is required for mRNA 3'end formation along with other factors.","ESP1:p, Hydroxyproline-rich glycoprotein family protein",1,NS,True,False,False,False,1.12986665124894,0.39063103676599287,1.12986665124894,0.0,0.0,-0.584962501,0.0,True,False
AT1G23800,Encodes a mitochondrial aldehyde dehydrogenase; nuclear gene for mitochondrial product.,"ALDH2B7:p, Aldehyde dehydrogenase family 2 member B7, mitochondrial ...",1,HS,False,True,False,False,-0.45361091220936434,1.1298484425848085,1.1298484425848085,0.0,-0.584962501,0.0,0.0,True,False
AT2G44760,dihydroorotate dehydrogenase (DUF3598);(source:Araport11),"AT2G44760:p, Domain of unknown function (DUF3598)",1,HS,False,True,False,False,-0.9425085299470406,1.1294422816862286,1.1294422816862286,0.906890596,0.485426827,-3.64385619,-3.95419631,True,False
AT1G29400,"A member of mei2-like gene family, predominantly plant-based family of genes encoding RNA binding proteins with characteristic presence of a highly conserved RNA binding motif first described in the mei2 gene of the fission yeast S. pombe. In silico analyses reveal nine mei2 -like genes in A. thaliana. They were grouped into four distinct clades, based on overall sequence similarity and subfamily-specific sequence elements. AML5 is a member of two sister clades of mei2-like gene family, AML1 through AML5, and belongs to the clade named ALM235. Among mei2-like genes, AML5 is the transcript with highest frequency of alternative splicing. Expression was detected during embryo development (heart and torpedo stage) and in vegetative and floral apices.","ML5:p, Protein MEI2-like 5",1,HS,False,True,False,False,0.5383753688896098,1.127159326836711,1.127159326836711,0.584962501,-0.169925001,-2.0,-0.304854582,True,False
AT1G32220,NAD(P)-binding Rossmann-fold superfamily protein;(source:Araport11),"AT1G32220:p, Uncharacterized protein At1g32220, chloroplastic ...",1,HS,False,True,False,False,0.1508775765631544,1.1251800483561598,1.1251800483561598,-0.485426827,-0.263034406,0.0,0.0,True,False
AT5G64940,ABC1K8 is a member of an atypical protein kinase family that is induced by heavy metals. Loss of function mutations affect the metabolic profile of chloroplast lipids. It appears to function along with ABC1K7 in mediating lipid membrane changes in response to stress. The mRNA is cell-to-cell mobile.,"ATH13:p, Protein ACTIVITY OF BC1 COMPLEX KINASE 8, chloroplastic ...",1,HS,False,True,False,False,0.6062846884003036,1.1248038656350394,1.1248038656350394,0.0,0.0,-2.584962501,-2.0,True,False
AT1G53280,"Encodes a homolog of animal DJ-1 superfamily protein.  In the A. thaliana genome, three genes encoding close homologs of human DJ-1 were identified AT3G14990 (DJ1A), AT1G53280 (DJ1B) and AT4G34020 (DJ1C).  Among the three homologs, DJ1C is essential for chloroplast development and viability. It exhibits glyoxalase activity towards glyoxal and methylglyoxal.","AT1G53280:p, Protein DJ-1 homolog B",1,NS,True,False,False,False,1.1246540111910612,0.38052589423472594,1.1246540111910612,-0.054447784,-0.144389909,0.584962501,0.0,True,False
AT2G33800,"Encodes SCABRA1 (SCA1), a nuclear gene encoding a plastid-type ribosomal protein that functions &#8232;as a structural component of the 70S plastid ribosome. The sca1-rps5 allele exhibits  defects in plastid 16SrRNA processing and a resulting decrease in accumulation of photosynthetic proteins. Loss-of-function mutations enhance the polarity defects of the as2 mutants.","AT2G33800:p, 30S ribosomal protein S5, chloroplastic",1,HS,False,True,False,False,-0.004332451451750845,1.1242307631702555,1.1242307631702555,0.0,-0.459431619,-0.38332864,-0.339850003,True,False
AT4G39690,"Encodes a homolog of the yeast mic60 protein that is localized in the inner membrane of the mitochondrion, interacts with Tom40 as part of a large lipid-enriched complex called the mitochondrial transmembrane lipoprotein complex (MTL) and is involved in mitochondrial lipid trafficking.","AT4G39690:p, AT4g39690/T19P19_80",1,HS,False,True,False,False,0.27629792606460496,1.1231417058158586,1.1231417058158586,0.584962501,-0.584962501,-0.584962501,-1.0,True,False
AT1G01300,Eukaryotic aspartyl protease family protein;(source:Araport11),"AT1G01300:p, Aspartyl protease family protein 2",1,NS,True,False,False,False,1.1222144555837947,0.20492960553493833,1.1222144555837947,0.125530882,-0.137503524,1.0,-0.584962501,True,False
AT5G54750,"Part of multi-protein complex, acting as guanine nucleotide exchange factors (GEFs) and possibly as tethers, regulating intracellular trafficking.","AT5G54750:p, Trafficking protein particle complex subunit",1,HS,False,True,False,False,0.291703060730334,1.1212318294140404,1.1212318294140404,0.584962501,-0.263034406,0.0,0.0,True,False
AT3G46510,"Encodes a protein containing a UND, a U-box, and an ARM domain. This protein has E3 ubiquitin ligase activity based on in vitro assays.  Can be phosphorylated in vitro by MLPK, ARK1, and ARK2 but not by SD1-29. Involved in ubiquitination of pattern recognition receptor FLS2.","PUB13:p, U-box domain-containing protein 13",1,HS,False,True,False,False,-0.5693212708644877,1.120743270712031,1.120743270712031,0.584962501,1.0,-1.321928095,-1.0,True,False
AT2G45220,Pectin methylesterase involved in pectin  remodelling. Regulated by its PRO region that triggers PME activity in the resistance to Botrytis cinerea.,"AT2G45220:p, Probable pectinesterase/pectinesterase inhibitor ...",1,HS,False,True,False,False,0.28327751757124087,1.120483005247692,1.120483005247692,0.584962501,0.0,0.0,0.0,True,False
AT1G73230,Nascent polypeptide-associated complex NAC;(source:Araport11),"AT1G73230:p, Nascent polypeptide-associated complex subunit beta ...",1,HS,False,True,False,False,-0.039578785695831516,1.1198512750406018,1.1198512750406018,-0.807354922,0.067114196,-1.321928095,-0.584962501,True,False
AT2G32500,Stress responsive alpha-beta barrel domain protein;(source:Araport11),"AT2G32500:p, At2g32500",1,HS,False,True,False,False,0.42230823730327965,1.1192758221667352,1.1192758221667352,0.192645078,0.0,0.0,0.0,True,False
AT5G19690,encodes an oligosaccharyl transferase involved response to high salt. Mutants are hypersensitive to high salt conditions The mRNA is cell-to-cell mobile.,"STT3A:p, Dolichyl-diphosphooligosaccharide--protein glycosyltransferase ...",1,HS,False,True,False,False,0.6368101727182075,1.1177191594270395,1.1177191594270395,0.584962501,-0.321928095,0.0,0.0,True,False
AT2G23610,"Encodes a protein shown to have carboxylesterase activity, methyl IAA esterase activity, and methyl jasmonate esterase activity in vitro. This protein does not act on methyl salicylate, MeGA4, or MEGA9 in vitro.","MES3:p, MES3",1,NS,True,False,False,False,1.1175357557345715,0.48249744239913467,1.1175357557345715,-0.206450877,-0.169925001,0.0,0.0,True,False
AT1G04530,"Encodes one of the 36 carboxylate clamp (CC)-tetratricopeptide repeat (TPR) proteins (Prasad 2010, Pubmed ID: 20856808) with potential to interact with Hsp90/Hsp70 as co-chaperones.","AT1G04530:p, Tetratricopeptide repeat (TPR)-like superfamily protein",1,HS,False,True,False,False,-0.05187884380224011,1.1170150872163718,1.1170150872163718,0.152003093,-0.206450877,-1.222392421,-0.94753258,True,False
AT5G42050,"Stress responsive asparagine-rich protein. Binds to PevD (Verticillium dahliae ) fungal effector protein. NRP interacts  with CRY2, leading to increased cytoplasmic accumulation of CRY2 in a blue light-independent manner (PMID:28633330).NRP also binds FyPP3 and recruits it to endosomes and thus targets it for degradation.","AT5G42050:p,",1,HS,False,True,False,False,0.041156672681546505,1.11676024221914,1.11676024221914,0.0,0.0,0.0,0.415037499,True,False
AT1G12800,"SDP is a chloroplast localized RNA binding protein that is required for plastid rRNA processing. Plants harboring a mutation in SDP have numerous defects including reduced chlorophyll content, poor growth, yellow leaves and abnormal chloroplasts.","AT1G12800:p, Nucleic acid-binding, OB-fold-like protein",1,HS,False,True,False,False,0.5673921933316052,1.1164736813559748,1.1164736813559748,1.0,1.222392421,-4.115477217,-4.882643049,True,False
AT3G11200,"Encodes a member of the Alfin1-like family of nuclear-localized PHD (plant homeodomain) domain containing proteins. All AL proteins except AL3 bind to di- or trimethylated histone H3 (H3K4me3/2). Members of this family include: AT5G05610 (AL1), AT3G11200 (AL2), AT3G42790 (AL3), AT5G26210 (AL4), AT5G20510 (AL5), AT2G02470 (AL6), AT1G14510 (AL7).","AL2:p, PHD finger protein ALFIN-LIKE 2",1,HS,False,True,False,False,-0.03086414256276762,1.116468152144357,1.116468152144357,0.362570079,0.05246742,-1.321928095,-1.321928095,True,False
AT4G26555,"Encodes a chloroplast lumen-targeted immunophilin that plays a role in the acclimation of plants under photosynthetic stress conditions, probably by regulating PsaL stability.","AT4G26555:p, Peptidyl-prolyl cis-trans isomerase FKBP16-1, chloroplastic ...",1,HS,False,True,False,False,-0.12454744361729113,1.1160673293792718,1.1160673293792718,-1.0,0.415037499,0.0,0.0,True,False
AT5G16440,"Encodes a protein with isopentenyl diphosphate:dimethylallyl diphosphate isomerase activity. There is genetic evidence that it functions in the mevalonate, but not the MEP biosynthetic pathway.","IPP1:p, Isopentenyl-diphosphate Delta-isomerase I, chloroplastic ...",1,NS,True,False,False,False,1.115964271785675,0.9869554510110445,1.115964271785675,0.0,0.289506617,0.0,0.0,True,False
AT5G05610,"Encodes a member of the Alfin1-like family of nuclear-localized PHD (plant homeodomain) domain containing proteins. All AL proteins except AL3 bind to di- or trimethylated histone H3 (H3K4me3/2). Members of this family include: AT5G05610 (AL1), AT3G11200 (AL2), AT3G42790 (AL3), AT5G26210 (AL4), AT5G20510 (AL5), AT2G02470 (AL6), AT1G14510 (AL7).","AL1:p, AL1",1,HS,False,True,False,False,0.3874027450411948,1.1159262055848687,1.1159262055848687,0.0,1.289506617,0.0,0.0,True,False
AT5G13550,Encodes a sulfate transporter.,"SULTR4;1:p, Sulfate transporter 4, chloroplastic",1,HS,False,True,False,False,0.2201366672694706,1.1158624695378092,1.1158624695378092,0.0,0.0,-0.584962501,-1.321928095,True,False
AT1G19570,"Encodes a member of the dehydroascorbate reductase gene family. Critical for a mutualistic symbiosis between the host Arabidopsis and the root colonizing fungus Piriformospora indica.Encodes about 50-60% of extractable leaf GSH-dependent DHAR activity, but single knockout mutants show unaltered ascorbate and glutathione status in optimal and oxidative stress conditions (PMID:28381499). Acts redundantly with DHAR2 to oxidize glutathione in response to increased intracelullar hydrogen peroxide (catalase deficiency) .   Complementation of a cat2 dhar1 dhar2 dhar3 quadruple mutant with DHAR1 fully restores cat2 phenotype and pathogenesis-related responses","DHAR1:p, Glutathione S-transferase DHAR1, mitochondrial",1,both,True,True,False,False,1.0877609413184035,1.1148368443016698,1.1148368443016698,-0.371968777,-0.194172548,3.700439718,0.0,True,False
AT5G19510,Translation elongation factor EF1B/ribosomal protein S6 family protein;(source:Araport11),"AT5G19510:p, Elongation factor 1-beta 2",1,HS,False,True,False,False,-0.062212286469409614,1.1144394710647778,1.1144394710647778,0.103093493,0.122856748,1.459431619,-0.321928095,True,False
AT1G12920,Encodes a eukaryotic release factor one homolog.,"ERF1-2:p, Eukaryotic peptide chain release factor subunit 1-2 ...",1,HS,False,True,False,False,0.23382990089748815,1.114333046782961,1.114333046782961,-0.485426827,0.415037499,0.0,-1.169925001,True,False
AT3G23570,alpha/beta-Hydrolases superfamily protein;(source:Araport11),"AT3G23570:p, Alpha/beta-Hydrolases superfamily protein",1,NS,True,False,False,False,1.1137508326099734,0.0,1.1137508326099734,0.169925001,0.192645078,1.0,0.0,True,False
AT1G69370,Encodes chorismate mutase 3 (CM3).,"CM3:p,",1,HS,False,True,False,False,0.20271202094537005,1.1135758246592384,1.1135758246592384,-0.415037499,-0.169925001,0.0,0.0,True,False
AT5G61760,"Encodes an inositol polyphosphate 3-/6-/5-kinase that is localized to the nucleus. Able to complement a mutation in a yeast transcriptional regulator gene (ARG82/IPK2).  Acts redundantly with ATIPK2alpha during pollen   development, pollen tube guidance and embryogenesis.","IPK2BETA:p, Inositol polyphosphate multikinase beta",1,HS,False,True,False,False,-0.3684830392920078,1.113575321845226,1.113575321845226,-1.0,-1.263034406,0.0,0.0,True,False
AT3G56460,GroES-like zinc-binding alcohol dehydrogenase family protein;(source:Araport11),"AT3G56460:p, GroES-like zinc-binding alcohol dehydrogenase family ...",1,HS,False,True,False,False,0.28382643773968524,1.11214603740688,1.11214603740688,0.093109404,0.08246216,-0.584962501,-1.0,True,False
AT1G11580,methylesterase PCR A;(source:Araport11),"PMEPCRA:p, methylesterase PCR A",1,HS,False,True,False,False,0.8965034111090535,1.1117090679477102,1.1117090679477102,1.0,0.0,0.0,0.0,True,False
AT5G65430,member of 14-3-3 proteins. This protein is reported to interact with the BZR1 transcription factor involved in brassinosteroid signaling and may affect the nucleocytoplasmic shuttling of BZR1,"GRF8:p, General regulatory factor 8",1,HS,False,True,False,False,-0.23027917683069596,1.1106825086604313,1.1106825086604313,-0.192645078,0.530514717,0.415037499,-0.584962501,True,False
AT5G36210,alpha/beta-Hydrolases superfamily protein;(source:Araport11),"AT5G36210:p, Alpha/beta-Hydrolases superfamily protein",1,HS,False,True,False,False,-0.2665184548169051,1.1102186899354587,1.1102186899354587,0.0,0.125530882,0.0,0.0,True,False
AT3G18280,Bifunctional inhibitor/lipid-transfer protein/seed storage 2S albumin superfamily protein;(source:Araport11),"AT3G18280:p,",1,NS,True,False,False,False,1.1100936929685454,0.5256410341306903,1.1100936929685454,1.0,1.0,0.0,0.0,True,False
AT1G19920,encodes a chloroplast form of ATP sulfurylase.,"APS2:p, ATP sulfurylase 2",1,HS,False,True,False,False,-0.031244799530840524,1.1098392119768816,1.1098392119768816,0.321928095,-0.237039197,0.0,0.0,True,False
AT1G79470,Aldolase-type TIM barrel family protein;(source:Araport11),"AT1G79470:p, Inosine-5 -monophosphate dehydrogenase 1",1,NS,True,False,False,False,1.109667120423754,0.7710695808450947,1.109667120423754,0.0,1.222392421,0.0,0.415037499,True,False
AT2G20550,HSP40/DnaJ peptide-binding protein;(source:Araport11),"AT2G20550:p, At2g20550",1,HS,False,True,False,False,0.3109104681943395,1.107746780948482,1.107746780948482,0.0,0.0,-0.144389909,1.392317423,True,False
AT5G36170,Required for normal processing of polycistronic plastidial transcripts,"HCF109:p, Peptide chain release factor PrfB1, chloroplastic",1,HS,False,True,False,False,-0.9168328291170924,1.106637590003051,1.106637590003051,0.0,-0.169925001,-4.672425342,-4.727920455,True,False
AT2G31725,FAM136A-like protein (DUF842);(source:Araport11),"AT2G31725:p, Expressed protein",1,NS,True,False,False,False,1.1062645563303393,0.6868529033560182,1.1062645563303393,0.0,0.152003093,0.0,0.0,True,False
AT1G45474,Encodes a component of the light harvesting complex of photosystem I.,"LHCA5:p, Photosystem I chlorophyll a/b-binding protein 5, chloroplastic ...",1,HS,False,True,False,False,0.5201455411914486,1.105974838099922,1.105974838099922,-0.736965594,-0.263034406,0.0,-0.584962501,True,False
AT3G02660,"Tyrosyl-tRNA synthetase, class Ib, bacterial/mitochondrial;(source:Araport11)","emb2768:p, Tyrosine--tRNA ligase",1,HS,False,True,False,False,0.0952764823757751,1.105885215796765,1.105885215796765,0.152003093,0.502500341,0.0,0.0,True,False
AT5G03520,GTPase that colocalizes with golgi and plasma membranes.,"RAB8C:p, RAB8C",1,HS,False,True,False,False,-0.22004280935633896,1.1057088301230051,1.1057088301230051,-0.415037499,-0.263034406,0.0,0.0,True,False
AT2G04880,"Encodes WRKY1, a member of the WRKY transcription factors in plants involved in disease resistance, abiotic stress, senescence as well as in some developmental processes.  WRKY1 is involved in the salicylic acid signaling pathway.  The crystal structure of the WRKY1 C-terminal domain revealed a zinc-binding site and identified the DNA-binding residues of WRKY1. The mRNA is cell-to-cell mobile.","ZAP1:p, WRKY transcription factor 1",1,HS,False,True,False,False,0.774755683623117,1.1053156873546803,1.1053156873546803,0.0,0.0,0.0,-0.584962501,True,False
AT4G11790,Pleckstrin homology (PH) domain superfamily protein;(source:Araport11),"AT4G11790:p, AT4g11790/T5C23_220",1,HS,False,True,False,False,-0.19711539347426546,1.1050361817458487,1.1050361817458487,0.807354922,0.584962501,-4.832890014,-4.614709844,True,False
AT2G17870,"Encodes COLD SHOCK DOMAIN PROTEIN 3 (CSP3), involved in the acquisition of freezing tolerance.","CSP3:p, Cold shock domain-containing protein 3",1,HS,False,True,False,False,-0.044779750152015275,1.1050116038130189,1.1050116038130189,-0.321928095,0.0,-0.736965594,-1.070389328,True,False
AT4G15560,Encodes a protein with 1-deoxyxylulose 5-phosphate synthase activity involved in the MEP pathway. It is essential for chloroplast development in Arabidopsis,"CLA1:p, DXS1",1,HS,False,True,False,False,0.30434409693800646,1.104160111300486,1.104160111300486,0.0,0.251538767,-0.678071905,-0.584962501,True,False
AT2G42690,alpha/beta-Hydrolases superfamily protein;(source:Araport11),"AT2G42690:p, Phospholipase A1-IIdelta",1,both,True,True,False,False,1.0326920864292994,1.1041354405254964,1.1041354405254964,0.0,0.0,2.321928095,0.0,True,False
AT3G06110,Encodes a nuclear-localized MAP kinase phosphatase. Plants with reduced levels of MKP2 transcripts are hypersensitive to ozone and ozone-mediated activation of MPK3 and MPK6 is prolonged in these plants.,"MKP2:p, Dual specificity protein phosphatase 1B",1,both,True,True,False,False,1.010426190431311,1.1038068136086325,1.1038068136086325,0.0,0.0,-1.544320516,-0.11783649,True,False
AT5G27120,"SAR DNA-binding protein, putative, strong similarity to SAR DNA-binding protein-1 (Pisum sativum) GI:3132696; contains Pfam profile PF01798: Putative snoRNA binding domain; has similarity to MAR binding NOP58 protein The mRNA is cell-to-cell mobile.","AT5G27120:p, Probable nucleolar protein 5-1",1,NS,True,False,False,False,1.1037670784500244,0.5099126361604094,1.1037670784500244,0.299560282,-0.222392421,0.0,0.0,True,False
AT4G30310,FGGY family of carbohydrate kinase;(source:Araport11),"AT4G30310:p, FGGY family of carbohydrate kinase",1,HS,False,True,False,False,-0.5346469382529875,1.1037669097841847,1.1037669097841847,0.222392421,0.022720077,1.0,-0.584962501,True,False
AT5G54110,"Encodes a highly polar protein with more than 60% hydrophilic amino acid residues that is associated with the plasma membrane.  It has limited secondary structure similarity to VAP-33 from Aplysia, which may be involved in membrane trafficking. The mRNA is cell-to-cell mobile.","MAMI:p, Vesicle-associated protein 4-1",1,HS,False,True,False,False,0.5189492572011776,1.103359965796583,1.103359965796583,0.584962501,0.584962501,-0.584962501,0.0,True,False
AT2G05990,"Encodes enoyl-ACP reductase a component of the fatty acid synthase complex.  A reduced function mutation in this gene, mod1, was found in a screen for premature cell death mutants. Mutant plants have reduced lipid level and pleiotropic morphological defects, including chlorotic and abnormally shaped leaves. The mRNA is cell-to-cell mobile.","MOD1:p, Enoyl- reductase , chloroplastic",1,HS,False,True,False,False,-0.09346351015109428,1.1028606771711802,1.1028606771711802,-0.222392421,0.415037499,-2.169925001,-3.584962501,True,False
AT2G17700,ACT-like protein tyrosine kinase family protein;(source:Araport11),"AT2G17700:p, Serine/threonine-protein kinase STY8",1,HS,False,True,False,False,-0.59867043582489,1.102800331498386,1.102800331498386,0.0,0.415037499,0.0,0.415037499,True,False
AT1G19220,"Encodes an auxin response factor that contains the conserved VP1-B3 DNA-binding domain at its N-terminus and the Aux/IAA-like domains III and IV present in most ARFs at its C-terminus. The protein interacts with IAA1 (yeast two hybrid) and other auxin response elements such as ER7 and ER9 (yeast one hybrid). ARF19 protein can complement many aspects of the arf7 mutant phenotype and , together with ARF7, is involved in the response to ethylene.  In the arf7 arf19 double mutant, several auxin-responsive genes (e.g. IAA5, LBD16, LBD29 and LBD33) are no longer upregulated by auxin.","ARF19:p, Auxin response factor 19",1,HS,False,True,False,False,0.12709403979564887,1.1012312873131116,1.1012312873131116,0.0,0.0,0.0,0.736965594,True,False
AT3G05270,"Encodes a protein that localizes at motile vesicle-like small compartments in differentiating xylem cells that is associated with microtubule plus-ends.  VETH-positive compartments are unlikely to be elements in conventional endomembrane trafficking pathways.  It can associate with COG2, and together these two proteins co-localize with the EXO70A1 exocyst subunit, tethering EXO70A1 to compartments associated with cortical microtubules.","AT3G05270:p, Filament-like plant protein 3",1,HS,False,True,False,False,-0.09917112475585506,1.100943308253407,1.100943308253407,0.0,0.0,-3.523561956,-3.0,True,False
AT1G64400,AMP-dependent synthetase and ligase family protein;(source:Araport11),"LACS3:p, Long chain acyl-CoA synthetase 3",1,HS,False,True,False,False,0.11343091118908818,1.1009264048244303,1.1009264048244303,1.0,-0.584962501,0.0,0.0,True,False
AT2G36880,methionine adenosyltransferase 3;(source:Araport11),"MAT3:p, S-adenosylmethionine synthase",1,HS,False,True,False,False,0.5476724756088898,1.1008624192307308,1.1008624192307308,-0.095157233,0.048255169,0.91753784,-0.295455884,True,False
AT3G13060,evolutionarily conserved C-terminal region 5;(source:Araport11),"ECT5:p, ECT5",1,HS,False,True,False,False,0.1008852540710853,1.0999208470424797,1.0999208470424797,0.0,0.0,-0.485426827,0.263034406,True,False
AT4G21320,Encodes heat-stress-associated 32-kD protein. Up-regulated by heat shock. Thermotolerance in a knockout mutant was compromised following a long recovery period (> 24 h) after acclimation heat shock treatment.,"HSA32:p, HSA32",1,NS,True,False,False,False,1.0986240351222625,0.1457962264781913,1.0986240351222625,0.0,0.0,0.0,-0.169925001,True,False
AT3G28860,"Encodes a member of the ATP-binding cassette (ABC) transporter family that is involved in auxin transport and is involved in postembryonic organ separation. Also known as AtMDR11 and PGP19. Possibly regulates auxin-dependent responses by influencing basipetal auxin transport in the root. Acts upstream of phyA in regulating hypocotyl elongation and gravitropic response. Exerts nonredundant, partially overlapping functions with the ABC transporter encoded by AtPGP1.","ABCB19:p, ABC transporter B family member 19",1,HS,False,True,False,False,0.844150150777071,1.0982274759466952,1.0982274759466952,0.584962501,0.415037499,0.0,0.0,True,False
AT5G11490,Encodes a component of the AP4 complex and is involved in vacuolar sorting of storage proteins.,"AT5G11490:p, Beta-adaptin-like protein",1,HS,False,True,False,False,0.3803458859542093,1.0980258365768774,1.0980258365768774,0.0,-0.295455884,-0.584962501,0.0,True,False
AT4G12730,"AF333971 Arabidopsis thaliana fasciclin-like arabinogalactan-protein 2 (Fla2) mRNA, complete cds. Fasciclin-like arabinogalactan protein. Possibly involved in embryogenesis and seed development.","FLA2:p, Fasciclin-like arabinogalactan protein 2",1,HS,False,True,False,False,-0.002956871972700186,1.0978498466669235,1.0978498466669235,-1.0,0.415037499,0.0,0.0,True,False
AT2G41020,WW domain-containing protein;(source:Araport11),"AT2G41020:p, WW domain-containing protein",1,HS,False,True,False,False,0.6280665893412388,1.097220199796667,1.097220199796667,0.0,0.0,-0.584962501,-1.0,True,False
AT1G62380,Encodes a protein similar to 1-aminocyclopropane-1-carboxylic oxidase (ACC oxidase). Expression of the AtACO2 transcripts is affected by ethylene.,"ACO2:p, 1-aminocyclopropane-1-carboxylate oxidase 2",1,HS,False,True,False,False,0.48205383101996907,1.096297015046103,1.096297015046103,0.415037499,-0.044394119,0.321928095,0.415037499,True,False
AT5G64610,"Encodes an enzyme with histone acetyltransferase activity. HAM1 primarily acetylate histone H4, but also  display some ability to acetylate H3. Prior acetylation of lysine 5 on histone H4  reduces radioactive acetylation by either HAM1. HAM1 acetylates histone H4 lysine 5.","HAM1:p, Histone acetyltransferase of the MYST family 1",1,both,True,True,False,False,1.0933051576116224,1.0961859106004157,1.0961859106004157,0.0,0.736965594,-1.0,-1.0,True,False
